appid,name,release_date,achievements,categories,windows,mac,linux,developer,dlc_count,languages,required_age,price,short_description,players_now,reviews_positive,reviews_negative
2379780,Balatro,"Feb 20, 2024",31,2:Single-player;22:Steam Achievements;28:Full controller support;29:Steam Trading Cards;66:Color Alternatives;68:Custom Volume Controls;76:Mouse Only Option;74:Playable without Timed Input;77:Touch Only Option;23:Steam Cloud;62:Family Sharing,True,True,False,LocalThunk,1,English;French;Italian;German;Spanish - Spain;Dutch;Japanese;Polish;Portuguese - Brazil;Simplified Chinese;Spanish - Latin America;Traditional Chinese,0,14.99,"The poker roguelike. Balatro is a hypnotically satisfying deckbuilder where you play illegal poker hands, discover game-changing jokers, and trigger adrenaline-pumping, outrageous combos.",6879.0,138419,2933
1757300,Jump Space,"Sep 19, 2025",12,2:Single-player;1:Multi-player;9:Co-op;38:Online Co-op;22:Steam Achievements;28:Full controller support;23:Steam Cloud;62:Family Sharing,True,False,False,Keepsake Games,1,English*;French;German;Spanish - Spain;Korean;Polish;Portuguese - Brazil;Russian;Simplified Chinese;Swedish;Japanese;Ukrainian*languages with full audio support,0,19.99,"Jump Space (formerly Jump Ship) is a mission based co-op PvE for 1-4 players, where you are the crew of a spaceship. Transition seamlessly from crewing the ship to on-foot exploration and space walks. Explore, upgrade, and survive intense encounters in deep space together.",319.0,6100,860
1790600,DRAGON BALL: Sparking! ZERO,"Oct 10, 2024",50,2:Single-player;1:Multi-player;49:PvP;36:Online PvP;37:Shared/Split Screen PvP;24:Shared/Split Screen;22:Steam Achievements;28:Full controller support;67:Camera Comfort;68:Custom Volume Controls;69:Stereo Sound;23:Steam Cloud;44:Remote Play Together;61:HDR available;62:Family Sharing,True,False,False,"Spike Chunsoft Co., Ltd.",11,English*;French;Italian;German;Spanish - Spain;Arabic;Indonesian;Spanish - Latin America;Portuguese - Brazil;Polish;Russian;Simplified Chinese;Traditional Chinese;Japanese*;Korean;Thai*languages with full audio support,0,99.99,DRAGON BALL: Sparking! ZERO takes the legendary gameplay of the Budokai Tenkaichi series and raises it to whole new levels. Make yours the destructive power of the strongest fighters ever to appear in Dragon Ball!,529.0,41498,5254
2186680,"Warhammer 40,000: Rogue Trader","Dec 7, 2023",106,2:Single-player;1:Multi-player;9:Co-op;38:Online Co-op;27:Cross-Platform Multiplayer;22:Steam Achievements;29:Steam Trading Cards;30:Steam Workshop;64:Adjustable Text Size;68:Custom Volume Controls;76:Mouse Only Option;79:Save Anytime;69:Stereo Sound;65:Subtitle Options;70:Surround Sound;18:Partial Controller Support;23:Steam Cloud;62:Family Sharing,True,True,False,Owlcat Games,8,English*;French;German;Spanish - Spain;Russian;Simplified Chinese;Japanese;Turkish*languages with full audio support,0,49.99,"Made in a close partnership with Games Workshop, Warhammer 40,000: Rogue Trader is a story-rich classical RPG from Owlcat Games, developers of the critically acclaimed game, Pathfinder: Wrath of the Righteous.",3909.0,23025,3583
1158160,Coral Island,"Nov 14, 2023",51,2:Single-player;1:Multi-player;9:Co-op;38:Online Co-op;27:Cross-Platform Multiplayer;22:Steam Achievements;28:Full controller support;23:Steam Cloud;62:Family Sharing,True,False,False,Stairway Games,1,English;French;German;Spanish - Spain;Japanese;Simplified Chinese;Indonesian;Korean;Portuguese - Brazil;Thai,0,29.99,"Coral Island is a vibrant, laid-back farm sim reimagined with multiplayer! Experience enchanting island life at your own pace: farm with friends, nurture animals, build relationships, hang out with a diverse cast of characters, and dive into the magical Merfolk Kingdom.",1934.0,17075,2234
1211630,The Jackbox Party Pack 7,"Oct 14, 2020",20,2:Single-player;1:Multi-player;49:PvP;37:Shared/Split Screen PvP;9:Co-op;39:Shared/Split Screen Co-op;24:Shared/Split Screen;22:Steam Achievements;28:Full controller support;23:Steam Cloud;41:Remote Play on Phone;42:Remote Play on Tablet;44:Remote Play Together;62:Family Sharing,True,True,True,"Jackbox Games, Inc.",0,English**languages with full audio support,0,29.99,"Five new games: the hit threequel Quiplash 3, the collaborative chaos of The Devils and the Details, the fierce drawing game Champ’d Up, the speech game Talking Points and the guessing game Blather 'Round. Use phones or tablets as controllers and play with up to 8 players, and an audience of 10,000!",147.0,3752,122
413410,Danganronpa: Trigger Happy Havoc,"Feb 18, 2016",38,2:Single-player;22:Steam Achievements;28:Full controller support;29:Steam Trading Cards;23:Steam Cloud;41:Remote Play on Phone;42:Remote Play on Tablet;62:Family Sharing,True,True,True,"Spike Chunsoft Co., Ltd.",0,English*;Japanese*;Traditional Chinese*languages with full audio support,0,19.99,"Investigate murders, search for clues and talk to your classmates to prepare for trial. There, you'll engage in deadly wordplay, going back and forth with suspects. Dissect their statements and fire their words back at them to expose their lies! There's only one way to survive—pull the trigger.",4587.0,28346,1122
632470,Disco Elysium - The Final Cut,"Oct 15, 2019",45,2:Single-player;22:Steam Achievements;28:Full controller support;29:Steam Trading Cards;23:Steam Cloud;42:Remote Play on Tablet;62:Family Sharing,True,True,False,ZA/UM,2,English*;Simplified Chinese;Spanish - Spain;Korean;Portuguese - Brazil;French;German;Traditional Chinese;Russian;Polish;Japanese;Turkish;Arabic*languages with full audio support,0,39.99,"Disco Elysium - The Final Cut is a groundbreaking role playing game. You’re a detective with a unique skill system at your disposal and a whole city to carve your path across. Interrogate unforgettable characters, crack murders or take bribes. Become a hero or an absolute disaster of a human being.",1586.0,100354,7605
686810,Hell Let Loose,"Jul 27, 2021",195,1:Multi-player;49:PvP;36:Online PvP;22:Steam Achievements;18:Partial Controller Support;62:Family Sharing,True,False,False,Expression Games,29,English;French;German;Spanish - Spain;Russian;Simplified Chinese;Polish;Portuguese - Brazil;Traditional Chinese;Korean;Japanese,0,49.99,"Join the ever expanding experience of Hell Let Loose - a hardcore World War Two first person shooter with epic battles of 100 players with infantry, tanks, artillery, a dynamically shifting front line and a unique resource based RTS-inspired meta-game.",2308.0,78851,14895
3035120,Is This Seat Taken?,"Aug 7, 2025",26,2:Single-player;22:Steam Achievements;28:Full controller support;29:Steam Trading Cards;67:Camera Comfort;66:Color Alternatives;68:Custom Volume Controls;75:Keyboard Only Option;76:Mouse Only Option;74:Playable without Timed Input;77:Touch Only Option;23:Steam Cloud;62:Family Sharing,True,True,True,Poti Poti Studio,0,English;Spanish - Spain;Catalan;French;Japanese;Russian;Simplified Chinese;German;Turkish;Polish;Portuguese - Brazil;Italian;Czech;Dutch;Korean;Portuguese - Portugal;Thai;Traditional Chinese;Ukrainian,0,9.99,"Is This Seat Taken? is a logic puzzle game where you play matchmaker for groups of hilariously particular people. Each character has pet peeves that make seating them a delightful challenge. Find the perfect spot for each person to unlock new levels in this cozy, silly, and relatable experience.",460.0,4315,112
1966720,Lethal Company,"Oct 23, 2023",0,2:Single-player;1:Multi-player;9:Co-op;38:Online Co-op;68:Custom Volume Controls;69:Stereo Sound;18:Partial Controller Support;62:Family Sharing,True,False,False,Zeekerss,0,English**languages with full audio support,0,9.99,A co-op horror about scavenging at abandoned moons to sell scrap to the Company.,2684.0,389718,11471
1172380,STAR WARS Jedi: Fallen Order™,"Nov 14, 2019",39,2:Single-player;22:Steam Achievements;28:Full controller support;29:Steam Trading Cards;78:Adjustable Difficulty;69:Stereo Sound;70:Surround Sound;42:Remote Play on Tablet;43:Remote Play on TV;61:HDR available,True,False,False,Respawn Entertainment,0,English*;French*;Italian*;German*;Spanish - Spain*;Japanese*;Korean;Polish*;Portuguese - Brazil*;Russian*;Simplified Chinese;Spanish - Latin America*;Traditional Chinese*languages with full audio support,0,39.99,"A galaxy-spanning adventure awaits in Star Wars Jedi: Fallen Order, a 3rd person action-adventure title from Respawn. An abandoned Padawan must complete his training, develop new powerful Force abilities, and master the art of the lightsaber - all while staying one step ahead of the Empire.",2051.0,125687,16546
2369390,Far Cry® 6,"May 11, 2023",99,2:Single-player;1:Multi-player;9:Co-op;38:Online Co-op;22:Steam Achievements;13:Captions available;35:In-App Purchases;18:Partial Controller Support;61:HDR available,True,False,False,Ubisoft Toronto,8,English*;French*;Italian;German*;Spanish - Spain;Arabic;Japanese*;Korean;Portuguese - Brazil*;Russian*;Simplified Chinese;Spanish - Latin America*;Thai;Traditional Chinese*languages with full audio support,17,59.99,"Enter the adrenaline-filled world of a modern-day guerrilla revolution. With stunning vistas, visceral gunplay, and a huge variety of gameplay experiences, there's never been a better time to join the fight.",2133.0,20144,8099
3314790,CloverPit,"Sep 26, 2025",30,2:Single-player;22:Steam Achievements;28:Full controller support;23:Steam Cloud;62:Family Sharing,True,False,False,Panik Arcade,0,English*;French;Italian;German;Spanish - Spain;Japanese;Korean;Portuguese - Brazil;Russian;Simplified Chinese*languages with full audio support,0,9.99,A rogue-lite slot machine nightmare. Gamble for your life in a never-ending debt simulator!,2422.0,14667,1641
4000,Garry's Mod,"Nov 29, 2006",29,2:Single-player;1:Multi-player;49:PvP;36:Online PvP;47:LAN PvP;9:Co-op;38:Online Co-op;48:LAN Co-op;27:Cross-Platform Multiplayer;22:Steam Achievements;29:Steam Trading Cards;13:Captions available;30:Steam Workshop;66:Color Alternatives;68:Custom Volume Controls;78:Adjustable Difficulty;74:Playable without Timed Input;79:Save Anytime;69:Stereo Sound;23:Steam Cloud;8:Valve Anti-Cheat enabled;17:Includes level editor;16:Includes Source SDK;42:Remote Play on Tablet;62:Family Sharing,True,True,True,Facepunch Studios,0,English*;French;Italian;German;Spanish - Spain;Bulgarian;Czech;Danish;Dutch;Finnish;Greek;Hungarian;Japanese;Korean;Norwegian;Polish;Portuguese - Portugal;Portuguese - Brazil;Russian;Simplified Chinese;Swedish;Thai;Traditional Chinese;Turkish;Ukrainian;Vietnamese;Croatian;Estonian;Hebrew;Lithuanian;Slovak*languages with full audio support,0,9.99,Garry's Mod is a physics sandbox. There aren't any predefined aims or goals. We give you the tools and leave you to play.,19535.0,998421,31672
949230,Cities: Skylines II,"Oct 24, 2023",44,2:Single-player;22:Steam Achievements;28:Full controller support;23:Steam Cloud;62:Family Sharing,True,False,False,Colossal Order Ltd.,17,English;French;Italian;German;Japanese;Korean;Polish;Russian;Simplified Chinese;Portuguese - Brazil;Traditional Chinese;Spanish - Spain,0,49.99,"Raise a city from the ground up and transform it into a thriving metropolis with the most realistic city builder ever. Push your creativity and problem-solving to build on a scale you've never experienced. With deep simulation and a living economy, this is world-building without limits.",10967.0,30004,26074
2399420,Le Mans Ultimate,"Jul 22, 2025",44,2:Single-player;1:Multi-player;49:PvP;36:Online PvP;53:VR Supported;18:Partial Controller Support;62:Family Sharing,True,False,False,Studio 397,7,English;French;Italian;German;Spanish - Spain;Simplified Chinese,0,39.99,"Le Mans is a continually evolving story... powered by emotion, speed and glory. Le Mans Ultimate - the official game of the FIA World Endurance Championship and 24 Hours of Le Mans.",4160.0,8147,2066
921570,OCTOPATH TRAVELER™,"Jun 7, 2019",88,2:Single-player;22:Steam Achievements;28:Full controller support;29:Steam Trading Cards;23:Steam Cloud;41:Remote Play on Phone;42:Remote Play on Tablet;43:Remote Play on TV;62:Family Sharing,True,False,False,Square Enix,0,English*;French;Italian;German;Spanish - Spain;Japanese*;Simplified Chinese;Traditional Chinese;Korean*languages with full audio support,0,59.99,Eight travelers. Eight adventures. Eight roles to play. Embark on an epic journey across the vast and wondrous world of Orsterra and discover the captivating stories of each of the eight travelers.,813.0,10998,1780
286160,Tabletop Simulator,"Jun 5, 2015",26,2:Single-player;1:Multi-player;49:PvP;36:Online PvP;37:Shared/Split Screen PvP;9:Co-op;38:Online Co-op;39:Shared/Split Screen Co-op;24:Shared/Split Screen;27:Cross-Platform Multiplayer;22:Steam Achievements;28:Full controller support;52:Tracked Controller Support;53:VR Supported;29:Steam Trading Cards;30:Steam Workshop;23:Steam Cloud;17:Includes level editor;44:Remote Play Together;62:Family Sharing,True,True,True,Berserk Games,43,English,0,19.99,"Tabletop Simulator is the only simulator where you can let your aggression out by flipping the table! There are no rules to follow: just you, a physics sandbox, and your friends. Make your own online board games or play the thousands of community created mods. Unlimited gaming possibilities!",3682.0,42151,1742
2457220,Avowed,"Feb 18, 2025",50,2:Single-player;22:Steam Achievements;28:Full controller support;29:Steam Trading Cards;23:Steam Cloud;15:Stats;62:Family Sharing,True,False,False,Obsidian Entertainment,2,English*;French;Italian;German;Spanish - Spain;Polish;Portuguese - Brazil;Russian;Simplified Chinese;Spanish - Latin America;Japanese;Korean*languages with full audio support,0,69.99,"Avowed is a first-person fantasy RPG set in the world of Eora, where your choices carve a path through war, intrigue, and ancient mysteries. Navigate a land in turmoil, forge powerful alliances or deadly rivalries, and wield magic and steel to shape the fate of the Living Lands—and your own destiny.",260.0,7932,2420
1151640,Horizon Zero Dawn™ Complete Edition,"Aug 7, 2020",79,2:Single-player;22:Steam Achievements;28:Full controller support;23:Steam Cloud;42:Remote Play on Tablet;62:Family Sharing,True,False,False,Guerrilla,0,English*;French*;Italian*;German*;Spanish - Spain*;Arabic*;Danish;Dutch;Finnish;Japanese;Korean;Norwegian;Polish*;Portuguese - Portugal*;Portuguese - Brazil*;Russian*;Simplified Chinese;Spanish - Latin America*;Swedish;Traditional Chinese*languages with full audio support,12,,Experience Aloy’s legendary quest to unravel the mysteries of a future Earth ruled by Machines. Use devastating tactical attacks against your prey and explore a majestic open world in this award-winning action RPG!,710.0,83044,11505
1583230,High On Life,"Dec 13, 2022",44,2:Single-player;22:Steam Achievements;28:Full controller support;23:Steam Cloud;62:Family Sharing,True,False,False,"Squanch Games, Inc.",1,English*;French;Italian;German;Spanish - Latin America*languages with full audio support,18,39.99,"HIGH ON KNIFE DLC OUT NOW!! - Humanity is being threatened by an alien cartel who wants to use them as drugs. It’s up to you to rescue and partner with charismatic, talking guns, take down Garmantuous and his gang, and save the world!",287.0,15581,1751
2384580,DYNASTY WARRIORS: ORIGINS,"Jan 16, 2025",56,2:Single-player;22:Steam Achievements;28:Full controller support;29:Steam Trading Cards;66:Color Alternatives;68:Custom Volume Controls;78:Adjustable Difficulty;69:Stereo Sound;70:Surround Sound;23:Steam Cloud;61:HDR available;62:Family Sharing,True,False,False,"KOEI TECMO GAMES CO., LTD.",3,English*;French;Italian;German;Spanish - Spain;Simplified Chinese*;Traditional Chinese;Japanese*;Korean;Arabic*languages with full audio support,0,69.99,Become immersed in exhilarating battles as a nameless hero in the Three Kingdoms,3514.0,15735,1224
2951690,Sonic Rumble,"Nov 5, 2025",11,1:Multi-player;49:PvP;36:Online PvP;9:Co-op;38:Online Co-op;22:Steam Achievements;28:Full controller support;35:In-App Purchases,True,False,False,SEGA,0,English;Japanese;French;Indonesian;Portuguese - Brazil;Spanish - Latin America;Traditional Chinese;Hebrew;Malay;Italian;German;Spanish - Spain;Arabic;Dutch;Korean;Polish;Portuguese - Portugal;Russian;Simplified Chinese;Thai;Turkish;Vietnamese,0,0.0,"Ready, Set, Rumble! Join Sonic in this intense arcade royale game set in Dr. Eggman's diabolical Toy World. Collect legendary skins, all-new emotes, and build skills as you progress through this action-packed game! Mayhem is best with friends!",442.0,0,0
3159330,Assassin’s Creed Shadows,"Mar 19, 2025",72,2:Single-player;22:Steam Achievements;29:Steam Trading Cards;13:Captions available;35:In-App Purchases;64:Adjustable Text Size;67:Camera Comfort;66:Color Alternatives;68:Custom Volume Controls;78:Adjustable Difficulty;75:Keyboard Only Option;76:Mouse Only Option;71:Narrated Game Menus;74:Playable without Timed Input;79:Save Anytime;69:Stereo Sound;65:Subtitle Options;70:Surround Sound;18:Partial Controller Support;61:HDR available,True,False,False,Ubisoft Quebec,2,English*;French*;Italian*;German*;Spanish - Spain*;Arabic;Japanese*;Korean;Portuguese - Brazil*;Russian;Simplified Chinese;Traditional Chinese;Polish*languages with full audio support,17,69.99,Experience an epic action-adventure story set in feudal Japan! Become a lethal shinobi assassin and powerful legendary samurai as you explore a beautiful open world in a time of chaos.,2869.0,20480,5864
728880,Overcooked! 2,"Aug 7, 2018",54,2:Single-player;1:Multi-player;49:PvP;36:Online PvP;37:Shared/Split Screen PvP;9:Co-op;38:Online Co-op;39:Shared/Split Screen Co-op;24:Shared/Split Screen;22:Steam Achievements;28:Full controller support;29:Steam Trading Cards;23:Steam Cloud;41:Remote Play on Phone;42:Remote Play on Tablet;43:Remote Play on TV;44:Remote Play Together;62:Family Sharing,True,True,True,Ghost Town Games Ltd.,6,English;French;Italian;German;Spanish - Spain;Japanese;Simplified Chinese;Korean;Polish;Portuguese - Brazil;Traditional Chinese;Russian,0,48.49,Overcooked returns with a brand-new helping of chaotic cooking action! Journey back to the Onion Kingdom and assemble your team of chefs in classic couch co-op or online play for up to four players. Hold onto your aprons… it’s time to save the world again!,3527.0,51100,5145
1336490,Against the Storm,"Dec 8, 2023",80,2:Single-player;22:Steam Achievements;29:Steam Trading Cards;64:Adjustable Text Size;67:Camera Comfort;68:Custom Volume Controls;78:Adjustable Difficulty;79:Save Anytime;69:Stereo Sound;70:Surround Sound;23:Steam Cloud;62:Family Sharing,True,False,False,Eremite Games,3,English*;French;German;Spanish - Spain;Polish;Portuguese - Brazil;Russian;Simplified Chinese;Japanese;Korean;Traditional Chinese;Italian;Czech;Hungarian;Turkish;Ukrainian;Thai;Spanish - Latin America*languages with full audio support,0,29.99,"A dark fantasy city builder where you must rebuild civilization in the face of apocalyptic rains. As the Queen’s Viceroy, lead humans, beavers, lizards, foxes, and harpies to reclaim the wilderness and secure a future for civilization's last survivors.",1863.0,28749,1519
690830,Foundation,"Jan 31, 2025",45,2:Single-player;22:Steam Achievements;23:Steam Cloud;62:Family Sharing,True,False,False,Polymorph Games,1,English;French;Italian;German;Spanish - Spain;Russian;Portuguese - Brazil;Simplified Chinese;Japanese;Korean;Polish;Swedish;Turkish;Vietnamese;Czech;Thai;Ukrainian,0,34.99,"Foundation is a grid-less, laidback medieval city-building game with a focus on organic development, monument construction and resource management.",2029.0,18085,2975
2661300,Grounded 2,"Jul 29, 2025",0,2:Single-player;1:Multi-player;9:Co-op;38:Online Co-op;28:Full controller support;62:Family Sharing,True,False,False,Obsidian Entertainment,2,English*;French*;Italian;German;Spanish - Spain;Spanish - Latin America;Simplified Chinese*languages with full audio support,0,29.99,"Shrunk again, but the world is much larger. In this open-world, single-player or co-op survival adventure, craft weapons and armor, build your base, and traverse the playground on your buggy. But something else is out there—and it hasn’t forgotten you.",792.0,11729,2760
1196590,Resident Evil Village,"May 6, 2021",56,2:Single-player;22:Steam Achievements;28:Full controller support;29:Steam Trading Cards;23:Steam Cloud;61:HDR available;62:Family Sharing,True,False,False,"CAPCOM Co., Ltd.",7,English*;French*;Italian*;German*;Spanish - Spain*;Japanese*;Korean;Portuguese - Brazil*;Russian*;Simplified Chinese*;Traditional Chinese;Arabic;Thai;Spanish - Latin America*languages with full audio support,0,49.99,"Experience survival horror like never before in the 8th major installment in the Resident Evil franchise - Resident Evil Village. With detailed graphics, intense first-person action and masterful storytelling, the terror has never felt more realistic.",1583.0,86298,3959
255710,Cities: Skylines,"Mar 10, 2015",127,2:Single-player;22:Steam Achievements;29:Steam Trading Cards;30:Steam Workshop;23:Steam Cloud;17:Includes level editor;42:Remote Play on Tablet;62:Family Sharing,True,True,True,Colossal Order Ltd.,72,English;French;German;Spanish - Spain;Polish;Portuguese - Brazil;Russian;Simplified Chinese;Korean,0,29.99,Cities: Skylines is a modern take on the classic city simulation. The game introduces new game play elements to realize the thrill and hardships of creating and maintaining a real city whilst expanding on some well-established tropes of the city building experience.,9078.0,196348,14864
1671210,DELTARUNE,"Jun 4, 2025",0,2:Single-player;28:Full controller support;23:Steam Cloud;62:Family Sharing,True,True,False,tobyfox,1,English;Japanese,0,24.99,"Dive into the parallel story to UNDERTALE! Fight or spare your way through action-packed battles as you explore a mysterious world alongside an endearing cast of new and familiar characters. Chapters 1-4 will be available on launch, with more planned as free updates!",920.0,79044,1057
2456740,inZOI,"Mar 27, 2025",0,2:Single-player;18:Partial Controller Support;23:Steam Cloud;62:Family Sharing,True,True,False,inZOI Studio,1,Korean;English;French;Italian;German;Spanish - Spain;Russian;Japanese;Simplified Chinese;Traditional Chinese;Portuguese - Brazil;Portuguese - Portugal;Polish,0,39.99,&quot;Every life becomes a story&quot; Create your unique story by controlling and observing the lives of 'Zois'. Customize characters and build houses using inZOI's easy-to-use tools to live the life of your dreams and experience the different emotions of life created by its deep and detailed simulation.,1094.0,19004,5807
1607250,MY HERO ULTRA RUMBLE,"Sep 28, 2023",15,2:Single-player;1:Multi-player;49:PvP;36:Online PvP;9:Co-op;38:Online Co-op;27:Cross-Platform Multiplayer;22:Steam Achievements;35:In-App Purchases;18:Partial Controller Support,True,False,False,Byking Inc.,0,English*;Japanese*;French;Italian;German;Spanish - Spain*languages with full audio support,0,0.0,"Pick your favorite character, team up and fight to be the last ones standing in the new 24-player Battle Royale free to play game &quot;MY HERO ULTRA RUMBLE&quot;!",3729.0,11,14
22370,Fallout 3: Game of the Year Edition,"Dec 17, 2009",0,2:Single-player;62:Family Sharing,True,False,False,Bethesda Game Studios,0,English;French;German;Italian;Spanish - Spain,17,19.99,"Prepare for the Future™ With Fallout 3: Game of the Year Edition, experience the most acclaimed game of 2008 like never before. Create a character of your choosing and descend into an awe-inspiring, post-apocalyptic world where every minute is a fight for survival.",329.0,32783,7955
960090,Bloons TD 6,"Dec 17, 2018",153,2:Single-player;1:Multi-player;9:Co-op;38:Online Co-op;22:Steam Achievements;35:In-App Purchases;41:Remote Play on Phone;42:Remote Play on Tablet;62:Family Sharing,True,True,False,Ninja Kiwi,2,English;French;Italian;German;Danish;Finnish;Japanese;Korean;Norwegian;Portuguese - Brazil;Russian;Simplified Chinese;Spanish - Latin America;Swedish;Traditional Chinese;Turkish;Polish;Spanish - Spain;Arabic;Dutch;Thai,0,13.99,The Bloons are back and better than ever! Get ready for a massive 3D tower defense game designed to give you hours and hours of the best strategy gaming available.,7225.0,319993,8958
291550,Brawlhalla,"Oct 17, 2017",65,2:Single-player;1:Multi-player;49:PvP;36:Online PvP;37:Shared/Split Screen PvP;9:Co-op;38:Online Co-op;39:Shared/Split Screen Co-op;24:Shared/Split Screen;27:Cross-Platform Multiplayer;22:Steam Achievements;29:Steam Trading Cards;18:Partial Controller Support;41:Remote Play on Phone;42:Remote Play on Tablet;43:Remote Play on TV;44:Remote Play Together,True,True,False,Blue Mammoth Games,4,English*;French;Italian;German;Spanish - Spain;Japanese;Korean;Portuguese - Brazil;Russian;Simplified Chinese;Traditional Chinese;Spanish - Latin America;Turkish*languages with full audio support,0,0.0,"An epic platform fighter for up to 8 players online or local. Try casual free-for-alls, ranked matches, or invite friends to a private room. And it's free! Play cross-platform with millions of players on PlayStation, Xbox, Nintendo Switch, iOS, Android &amp; Steam! Frequent updates. Over sixty Legends.",6215.0,2453,442
