appid,name,release_date,achievements,categories,windows,mac,linux,developer,dlc_count,languages,required_age,price,short_description,players_now,reviews_positive,reviews_negative
1808500,ARC Raiders,"Oct 30, 2025",50,1:Multi-player;49:PvP;36:Online PvP;9:Co-op;38:Online Co-op;27:Cross-Platform Multiplayer;22:Steam Achievements;28:Full controller support;35:In-App Purchases;15:Stats;62:Family Sharing,True,False,False,Embark Studios,1,English*;French;Italian;German;Spanish - Spain;Japanese;Korean;Polish;Portuguese - Brazil;Russian;Simplified Chinese;Traditional Chinese;Turkish*languages with full audio support,0,39.99,"ARC Raiders is a multiplayer extraction adventure, set in a lethal future earth, ravaged by a mysterious mechanized threat known as ARC.",164712.0,126685,14509
2767030,Marvel Rivals,"Dec 5, 2024",49,1:Multi-player;49:PvP;36:Online PvP;9:Co-op;38:Online Co-op;27:Cross-Platform Multiplayer;22:Steam Achievements;28:Full controller support;35:In-App Purchases,True,False,False,NetEase Games,0,English*;French;Italian;German;Spanish - Spain;Russian;Turkish;Thai;Simplified Chinese*;Traditional Chinese;Spanish - Latin America;Korean;Japanese*;Polish;Portuguese - Brazil;Arabic*languages with full audio support,0,0.0,"Marvel Rivals is a Super Hero Team-Based PVP Shooter! Assemble an all-star Marvel squad, devise countless strategies by combining powers to form unique Team-Up skills and fight in destructible, ever-changing battlefields across the continually evolving Marvel universe!",55899.0,0,0
730,Counter-Strike 2,"Aug 21, 2012",1,1:Multi-player;27:Cross-Platform Multiplayer;29:Steam Trading Cards;30:Steam Workshop;35:In-App Purchases;64:Adjustable Text Size;67:Camera Comfort;66:Color Alternatives;68:Custom Volume Controls;74:Playable without Timed Input;69:Stereo Sound;70:Surround Sound;8:Valve Anti-Cheat enabled;15:Stats;41:Remote Play on Phone;42:Remote Play on Tablet;43:Remote Play on TV;63:Steam Timeline,True,False,True,Valve,1,Czech;Danish;Dutch;English*;Finnish;French;German;Hungarian;Italian;Japanese;Korean;Norwegian;Polish;Portuguese - Portugal;Portuguese - Brazil;Romanian;Russian;Simplified Chinese;Spanish - Spain;Swedish;Thai;Traditional Chinese;Turkish;Bulgarian;Ukrainian;Greek;Spanish - Latin America;Vietnamese;Indonesian*languages with full audio support,0,0.0,"For over two decades, Counter-Strike has offered an elite competitive experience, one shaped by millions of players from across the globe. And now the next chapter in the CS story is about to begin. This is Counter-Strike 2.",1017327.0,4107954,684676
2807960,Battlefield™ 6,"Oct 10, 2025",53,2:Single-player;1:Multi-player;49:PvP;36:Online PvP;27:Cross-Platform Multiplayer;22:Steam Achievements;28:Full controller support;35:In-App Purchases;67:Camera Comfort;72:Chat Speech-to-text;73:Chat Text-to-speech;66:Color Alternatives;68:Custom Volume Controls;78:Adjustable Difficulty;75:Keyboard Only Option;74:Playable without Timed Input;69:Stereo Sound;65:Subtitle Options;70:Surround Sound;23:Steam Cloud;61:HDR available,True,False,False,Battlefield Studios,7,English*;French*;Italian*;German*;Spanish - Spain*;Arabic;Japanese*;Korean*;Polish*;Portuguese - Brazil*;Simplified Chinese*;Spanish - Latin America*;Traditional Chinese*languages with full audio support,0,69.99,"The ultimate all-out warfare experience. In a war of tanks, fighter jets, and massive combat arsenals, your squad is the deadliest weapon.",116526.0,149213,67326
1091500,Cyberpunk 2077,"Dec 9, 2020",57,2:Single-player;22:Steam Achievements;28:Full controller support;29:Steam Trading Cards;64:Adjustable Text Size;67:Camera Comfort;66:Color Alternatives;68:Custom Volume Controls;78:Adjustable Difficulty;74:Playable without Timed Input;79:Save Anytime;69:Stereo Sound;65:Subtitle Options;70:Surround Sound;23:Steam Cloud;62:Family Sharing,True,True,False,CD PROJEKT RED,3,English*;French*;Italian*;German*;Spanish - Spain*;Arabic;Czech;Hungarian;Japanese*;Korean*;Polish*;Portuguese - Brazil*;Russian*;Simplified Chinese*;Spanish - Latin America;Thai;Traditional Chinese;Turkish;Ukrainian*languages with full audio support,17,59.99,"Cyberpunk 2077 is an open-world, action-adventure RPG set in the dark future of Night City — a dangerous megalopolis obsessed with power, glamor, and ceaseless body modification.",32892.0,691239,108947
3564740,Where Winds Meet,"Nov 14, 2025",34,2:Single-player;1:Multi-player;49:PvP;36:Online PvP;9:Co-op;38:Online Co-op;27:Cross-Platform Multiplayer;22:Steam Achievements;28:Full controller support;35:In-App Purchases,True,False,False,Everstone Studio,0,English*;Japanese;Simplified Chinese*;Traditional Chinese*;Korean;French;German;Spanish - Latin America*languages with full audio support,0,0.0,Where Winds Meet is an epic Wuxia open-world action-adventure RPG set in ancient China at the tenth century. Players will assume the role of a young sword master as they embark on a journey to uncover the mysteries of their own identity. Let the wind carry your legend on an epic journey to the East!,136104.0,0,0
2592160,Dispatch,"Oct 22, 2025",36,2:Single-player;22:Steam Achievements;28:Full controller support;29:Steam Trading Cards;64:Adjustable Text Size;66:Color Alternatives;68:Custom Volume Controls;78:Adjustable Difficulty;76:Mouse Only Option;74:Playable without Timed Input;65:Subtitle Options;23:Steam Cloud;62:Family Sharing,True,False,False,AdHoc Studio,2,English*;French;Italian;German;Spanish - Spain;Japanese;Korean;Simplified Chinese;Portuguese - Brazil;Russian;Traditional Chinese*languages with full audio support,0,29.99,"Dispatch is a superhero workplace comedy where choices matter. Manage a dysfunctional team of misfit heroes and strategize who to send to emergencies around the city, all while balancing office politics, personal relationships, and your own quest to become a hero. All episodes out now!",11381.0,108670,2401
632360,Risk of Rain 2,"Aug 11, 2020",171,2:Single-player;1:Multi-player;49:PvP;36:Online PvP;9:Co-op;38:Online Co-op;28:Full controller support;29:Steam Trading Cards;64:Adjustable Text Size;67:Camera Comfort;68:Custom Volume Controls;78:Adjustable Difficulty;69:Stereo Sound;70:Surround Sound;23:Steam Cloud;25:Steam Leaderboards;41:Remote Play on Phone;42:Remote Play on Tablet;43:Remote Play on TV;62:Family Sharing,True,False,False,Hopoo Games,6,English;French;Italian;German;Spanish - Spain;Japanese;Korean;Portuguese - Brazil;Russian;Simplified Chinese;Turkish,0,24.99,"Escape a chaotic alien planet by fighting through hordes of frenzied monsters – with your friends, or on your own. Combine loot in surprising ways and master each character until you become the havoc you feared upon your first crash landing.",21700.0,211335,14327
261550,Mount & Blade II: Bannerlord,"Oct 25, 2022",50,2:Single-player;1:Multi-player;49:PvP;36:Online PvP;22:Steam Achievements;29:Steam Trading Cards;30:Steam Workshop;18:Partial Controller Support;23:Steam Cloud;17:Includes level editor;42:Remote Play on Tablet;62:Family Sharing,True,False,False,TaleWorlds Entertainment,3,English*;Simplified Chinese;Turkish;Traditional Chinese;French;Italian;Japanese;Korean;Polish;Portuguese - Brazil;Russian;Spanish - Latin America;German*languages with full audio support,0,49.99,"A strategy/action RPG. Create a character, engage in diplomacy, craft, trade and conquer new lands in a vast medieval sandbox. Raise armies to lead into battle and command and fight alongside your troops in massive real-time battles using a deep but intuitive skill-based combat system.",50553.0,188119,25549
3472040,NBA 2K26,"Sep 4, 2025",48,2:Single-player;1:Multi-player;49:PvP;36:Online PvP;37:Shared/Split Screen PvP;9:Co-op;38:Online Co-op;39:Shared/Split Screen Co-op;24:Shared/Split Screen;22:Steam Achievements;35:In-App Purchases;18:Partial Controller Support;23:Steam Cloud;44:Remote Play Together;62:Family Sharing,True,False,False,Visual Concepts,4,English*;French;Italian;German;Spanish - Spain;Japanese;Korean;Simplified Chinese;Traditional Chinese*languages with full audio support,0,69.99,"Bragging rights are on the line in MyCAREER, MyTEAM, MyNBA, The W, and Play Now. Showcase your bag of moves with hyper realism, Powered by ProPLAY™, and challenge your friends, or rivals, in NBA 2K26’s competitive modes—and leave no doubt that you wear the crown.",18989.0,3533,2291
3405690,EA SPORTS FC™ 26,"Sep 25, 2025",43,2:Single-player;1:Multi-player;49:PvP;36:Online PvP;37:Shared/Split Screen PvP;9:Co-op;38:Online Co-op;39:Shared/Split Screen Co-op;24:Shared/Split Screen;27:Cross-Platform Multiplayer;22:Steam Achievements;28:Full controller support;35:In-App Purchases;72:Chat Speech-to-text;78:Adjustable Difficulty;75:Keyboard Only Option;69:Stereo Sound;65:Subtitle Options;61:HDR available,True,False,False,EA Canada,1,English*;French*;Italian*;German*;Spanish - Spain*;Arabic*;Dutch*;Japanese*;Korean*;Polish*;Portuguese - Brazil*;Simplified Chinese*;Spanish - Latin America*;Turkish*;Czech;Danish;Norwegian;Portuguese - Portugal;Russian;Swedish;Traditional Chinese*languages with full audio support,0,69.99,"The Club is Yours in EA SPORTS FC™ 26. Play your way with an overhauled gameplay experience powered by community feedback, Manager Live Challenges that bring fresh storylines to the new season, and Archetypes inspired by greats of the game.",41186.0,9933,12160
2486820,Sonic Racing: CrossWorlds,"Sep 25, 2025",44,2:Single-player;1:Multi-player;49:PvP;37:Shared/Split Screen PvP;24:Shared/Split Screen;27:Cross-Platform Multiplayer;22:Steam Achievements;28:Full controller support;29:Steam Trading Cards;67:Camera Comfort;68:Custom Volume Controls;78:Adjustable Difficulty;75:Keyboard Only Option;69:Stereo Sound;23:Steam Cloud;15:Stats;62:Family Sharing,True,False,False,Sonic Team,4,English*;French*;Italian*;German*;Spanish - Spain*;Japanese*;Korean;Polish;Portuguese - Brazil;Russian;Simplified Chinese;Thai;Traditional Chinese;Spanish - Latin America*languages with full audio support,0,69.99,"Race across land, sea, air, space, and time in Sonic Racing: CrossWorlds! Warp through Travel Rings into new dimensions where something new awaits around every twist and turn.",1040.0,7321,348
2183900,"Warhammer 40,000: Space Marine 2","Sep 9, 2024",50,2:Single-player;1:Multi-player;49:PvP;36:Online PvP;9:Co-op;38:Online Co-op;27:Cross-Platform Multiplayer;22:Steam Achievements;28:Full controller support;29:Steam Trading Cards;64:Adjustable Text Size;67:Camera Comfort;66:Color Alternatives;68:Custom Volume Controls;78:Adjustable Difficulty;69:Stereo Sound;65:Subtitle Options;70:Surround Sound;23:Steam Cloud;62:Family Sharing,True,False,False,Saber Interactive,19,English*;French*;Italian;German*;Spanish - Spain*;Russian*;Czech;Japanese*;Korean;Polish;Portuguese - Brazil;Simplified Chinese*;Spanish - Latin America;Traditional Chinese;Turkish;Ukrainian;Thai*languages with full audio support,17,59.99,Embody the superhuman skill and brutality of a Space Marine. Unleash deadly abilities and devastating weaponry to obliterate the relentless Tyranid swarms. Defend the Imperium in spectacular third-person action in solo or multiplayer modes.,15049.0,114085,22509
1172470,Apex Legends™,"Nov 4, 2020",12,1:Multi-player;49:PvP;36:Online PvP;9:Co-op;38:Online Co-op;22:Steam Achievements;28:Full controller support;29:Steam Trading Cards;35:In-App Purchases;72:Chat Speech-to-text;74:Playable without Timed Input,True,False,False,Respawn,0,English*;French*;Italian*;German*;Spanish - Spain*;Japanese*;Korean*;Polish*;Portuguese - Brazil;Russian*;Simplified Chinese*;Traditional Chinese;Spanish - Latin America;Arabic*languages with full audio support,0,0.0,"Apex Legends is the award-winning, free-to-play Hero Shooter from Respawn Entertainment. Master an ever-growing roster of legendary characters with powerful abilities, and experience strategic squad play and innovative gameplay in the next evolution of Hero Shooter and Battle Royale.",106526.0,1180,390
1151340,Fallout 76,"Apr 14, 2020",72,1:Multi-player;20:MMO;49:PvP;36:Online PvP;9:Co-op;38:Online Co-op;22:Steam Achievements;35:In-App Purchases;74:Playable without Timed Input;69:Stereo Sound;70:Surround Sound;18:Partial Controller Support;42:Remote Play on Tablet,True,False,False,Bethesda Game Studios,2,English*;French*;Italian*;German*;Spanish - Spain*;Japanese*;Korean;Polish;Traditional Chinese;Russian;Simplified Chinese;Spanish - Latin America;Portuguese - Brazil*languages with full audio support,17,39.99,"Bethesda Game Studios welcome you to Fallout 76. Twenty-five years after the bombs fall, you and your fellow Vault Dwellers emerge into post-nuclear America. Explore a vast wasteland in this open-world multiplayer addition to the Fallout story.",6324.0,52984,17044
2215430,Ghost of Tsushima DIRECTOR'S CUT,"May 16, 2024",77,2:Single-player;1:Multi-player;49:PvP;36:Online PvP;9:Co-op;38:Online Co-op;22:Steam Achievements;28:Full controller support;29:Steam Trading Cards;64:Adjustable Text Size;67:Camera Comfort;66:Color Alternatives;68:Custom Volume Controls;78:Adjustable Difficulty;74:Playable without Timed Input;79:Save Anytime;69:Stereo Sound;65:Subtitle Options;70:Surround Sound;23:Steam Cloud;61:HDR available;62:Family Sharing,True,False,False,Sucker Punch Productions,1,English*;French*;Italian*;German*;Spanish - Spain*;Arabic;Czech;Danish;Dutch;Finnish;Greek;Hungarian;Japanese*;Korean;Norwegian;Polish*;Portuguese - Brazil*;Portuguese - Portugal*;Russian*;Simplified Chinese;Spanish - Latin America*;Swedish;Thai;Traditional Chinese;Turkish;Croatian*languages with full audio support,17,59.99,"A storm is coming. Venture into the complete Ghost of Tsushima DIRECTOR’S CUT on PC; forge your own path through this open-world action adventure and uncover its hidden wonders. Brought to you by Sucker Punch Productions, Nixxes Software and PlayStation Studios.",8538.0,48722,3275
230410,Warframe,"Mar 25, 2013",193,2:Single-player;1:Multi-player;9:Co-op;38:Online Co-op;27:Cross-Platform Multiplayer;22:Steam Achievements;28:Full controller support;29:Steam Trading Cards;30:Steam Workshop;35:In-App Purchases;67:Camera Comfort;66:Color Alternatives;68:Custom Volume Controls;74:Playable without Timed Input;69:Stereo Sound;70:Surround Sound;41:Remote Play on Phone;42:Remote Play on Tablet;43:Remote Play on TV;61:HDR available,True,False,False,Digital Extremes,14,English*;German;French;Italian;Korean;Spanish - Spain;Simplified Chinese;Russian;Japanese;Polish;Portuguese - Brazil;Traditional Chinese;Turkish;Ukrainian;Thai*languages with full audio support,17,0.0,Awaken as an unstoppable warrior and battle alongside your friends in this story-driven free-to-play online action game,65974.0,2525,352
3240220,Grand Theft Auto V Enhanced,"Mar 4, 2025",77,2:Single-player;1:Multi-player;49:PvP;36:Online PvP;9:Co-op;38:Online Co-op;22:Steam Achievements;35:In-App Purchases;18:Partial Controller Support;41:Remote Play on Phone;42:Remote Play on Tablet,True,False,False,Rockstar North,0,English*;French;Italian;German;Spanish - Spain;Japanese;Korean;Polish;Portuguese - Brazil;Russian;Simplified Chinese;Spanish - Latin America;Traditional Chinese*languages with full audio support,17,29.99,"Experience entertainment blockbusters Grand Theft Auto V and Grand Theft Auto Online — now upgraded for a new generation with stunning visuals, faster loading, 3D audio, and more, plus exclusive content for GTA Online players.",70450.0,86022,24433
438100,VRChat,"Feb 1, 2017",0,1:Multi-player;20:MMO;49:PvP;36:Online PvP;9:Co-op;38:Online Co-op;27:Cross-Platform Multiplayer;28:Full controller support;52:Tracked Controller Support;53:VR Supported;35:In-App Purchases,True,False,False,VRChat Inc.,0,English;French;Italian;German;Spanish - Spain;Japanese;Polish;Portuguese - Brazil;Russian;Simplified Chinese;Traditional Chinese,0,0.0,"Join our growing community as you explore, play, and help craft the future of social VR. Create worlds and custom avatars. Welcome to VRChat.",40846.0,124,25
1174180,Red Dead Redemption 2,"Dec 5, 2019",51,2:Single-player;1:Multi-player;49:PvP;36:Online PvP;9:Co-op;38:Online Co-op;22:Steam Achievements;35:In-App Purchases;18:Partial Controller Support;41:Remote Play on Phone;42:Remote Play on Tablet,True,False,False,Rockstar Games,0,English*;French;Italian;German;Spanish - Spain;Japanese;Korean;Polish;Russian;Simplified Chinese;Spanish - Latin America;Traditional Chinese;Portuguese - Brazil*languages with full audio support,17,59.99,"Arthur Morgan and the Van der Linde Gang are outlaws on the run. With federal agents and bounty hunters massing on their heels, the gang must rob, steal, and fight their way across the rugged heartland in order to survive.",43309.0,684059,58858
306130,The Elder Scrolls® Online,"May 22, 2017",0,1:Multi-player;20:MMO;49:PvP;36:Online PvP;9:Co-op;38:Online Co-op;29:Steam Trading Cards;13:Captions available;35:In-App Purchases;67:Camera Comfort;68:Custom Volume Controls;74:Playable without Timed Input;69:Stereo Sound;70:Surround Sound;18:Partial Controller Support;61:HDR available;62:Family Sharing,True,True,False,ZeniMax Online Studios,6,English*;French*;German*;Russian;Spanish - Spain;Simplified Chinese*languages with full audio support,17,19.99,"Every legend starts somewhere and in The Elder Scrolls Online, it starts with you. Join millions of players in an online, fantasy RPG set in a vast living Elder Scrolls world.",7700.0,107634,22845
3017860,DOOM: The Dark Ages,"May 14, 2025",28,2:Single-player;22:Steam Achievements;28:Full controller support;29:Steam Trading Cards;66:Color Alternatives;78:Adjustable Difficulty;70:Surround Sound;23:Steam Cloud;61:HDR available;62:Family Sharing,True,False,False,id Software,1,English*;French*;Italian*;German*;Spanish - Spain*;Arabic;Korean;Polish*;Portuguese - Brazil*;Russian*;Simplified Chinese;Spanish - Latin America*;Traditional Chinese;Japanese*;Turkish*languages with full audio support,17,69.99,"DOOM: The Dark Ages is the prequel to the critically acclaimed DOOM (2016) and DOOM Eternal that tells an epic cinematic story worthy of the DOOM Slayer’s legend. Players will step into the blood-stained boots of the DOOM Slayer, in this never-before-seen dark and sinister medieval war against Hell.",1553.0,17858,2599
311210,Call of Duty®: Black Ops III,"Nov 5, 2015",98,2:Single-player;1:Multi-player;9:Co-op;24:Shared/Split Screen;22:Steam Achievements;28:Full controller support;29:Steam Trading Cards;30:Steam Workshop;8:Valve Anti-Cheat enabled;25:Steam Leaderboards;41:Remote Play on Phone;42:Remote Play on Tablet;43:Remote Play on TV;44:Remote Play Together;62:Family Sharing,True,True,False,Treyarch,10,English*;French*;Italian*;German*;Spanish - Spain*;Simplified Chinese;Traditional Chinese;Japanese;Polish;Portuguese - Brazil*;Russian**languages with full audio support,17,59.99,Call of Duty®: Black Ops III Zombies Chronicles Edition includes the full base game plus the Zombies Chronicles content expansion.,3783.0,129138,17396
266410,iRacing,"Jan 12, 2015",0,2:Single-player;1:Multi-player;20:MMO;49:PvP;36:Online PvP;31:VR Support;18:Partial Controller Support;62:Family Sharing,True,False,False,iRacing.com Motorsport Simulations,0,English**languages with full audio support,0,9.99,"We are the world’s premier motorsports racing game. An iRacing membership provides entry into the newest form of motorsport: internet racing. Internet racing is a fun, easy, and inexpensive way for race fan and gamers alike to enjoy the thrill of the racetrack from the comfort of their home.",374.0,3678,699
3230400,EA SPORTS™ Madden NFL 26,"Aug 14, 2025",28,2:Single-player;1:Multi-player;49:PvP;36:Online PvP;37:Shared/Split Screen PvP;9:Co-op;38:Online Co-op;39:Shared/Split Screen Co-op;24:Shared/Split Screen;27:Cross-Platform Multiplayer;22:Steam Achievements;28:Full controller support;35:In-App Purchases;67:Camera Comfort;72:Chat Speech-to-text;73:Chat Text-to-speech;66:Color Alternatives;78:Adjustable Difficulty;74:Playable without Timed Input;69:Stereo Sound;70:Surround Sound;61:HDR available;62:Family Sharing,True,False,False,Tiburon,0,English**languages with full audio support,0,69.99,EA SPORTS™ Madden NFL 26 leverages a new AI-powered machine learning system to convert thousands of plays from nearly a decade of real NFL data into more explosive gameplay.,1954.0,1014,1220
3606480,Call of Duty®: Black Ops 7,"Nov 13, 2025",0,2:Single-player;1:Multi-player;49:PvP;36:Online PvP;9:Co-op;38:Online Co-op;27:Cross-Platform Multiplayer;22:Steam Achievements;13:Captions available;35:In-App Purchases;64:Adjustable Text Size;67:Camera Comfort;66:Color Alternatives;68:Custom Volume Controls;74:Playable without Timed Input;69:Stereo Sound;65:Subtitle Options;70:Surround Sound;18:Partial Controller Support;61:HDR available,True,False,False,Treyarch,0,English*;French*;Italian*;German*;Spanish - Spain*;Korean;Polish;Russian;Traditional Chinese;Japanese*;Spanish - Latin America*;Arabic;Simplified Chinese*;Portuguese - Brazil**languages with full audio support,17,69.99,"In Call of Duty®: Black Ops 7, Treyarch and Raven Software are bringing players the biggest Black Ops ever across an innovative Co-Op Campaign, an electrifying Multiplayer experience, and the legendary Round-Based Zombies mode.",0.0,832,1325
990080,Hogwarts Legacy,"Feb 10, 2023",45,2:Single-player;22:Steam Achievements;28:Full controller support;35:In-App Purchases;64:Adjustable Text Size;67:Camera Comfort;68:Custom Volume Controls;71:Narrated Game Menus;79:Save Anytime;69:Stereo Sound;70:Surround Sound;23:Steam Cloud;61:HDR available;62:Family Sharing,True,False,False,Avalanche Software,1,English*;French*;Italian*;German*;Spanish - Spain*;Arabic;Japanese*;Korean;Polish;Portuguese - Brazil*;Russian;Simplified Chinese;Spanish - Latin America*;Traditional Chinese*languages with full audio support,0,59.99,"Hogwarts Legacy is an immersive, open-world action RPG. Now you can take control of the action and be at the center of your own adventure in the wizarding world.",14824.0,227235,24631
1222670,The Sims™ 4,"Jun 18, 2020",0,2:Single-player;29:Steam Trading Cards;76:Mouse Only Option;74:Playable without Timed Input;79:Save Anytime;69:Stereo Sound;70:Surround Sound;42:Remote Play on Tablet,True,False,False,Maxis,105,English;French;Italian;German;Spanish - Spain;Czech;Danish;Dutch;Japanese;Norwegian;Polish;Portuguese - Brazil;Russian;Swedish;Finnish;Traditional Chinese;Simplified Chinese;Korean,0,0.0,Play with life and discover the possibilities. Unleash your imagination and create a world of Sims that’s wholly unique. Explore and customize every detail from Sims to homes–and much more.,20227.0,70586,11469
2373990,Solo Leveling: ARISE OVERDRIVE,"Nov 24, 2025",58,2:Single-player;1:Multi-player;9:Co-op;38:Online Co-op;28:Full controller support;62:Family Sharing,True,False,False,Netmarble Neo,1,English*;Korean*;French;Italian;German;Spanish - Spain;Russian;Indonesian;Japanese*;Simplified Chinese;Traditional Chinese;Thai;Portuguese - Brazil*languages with full audio support,0,39.99,"Solo Leveling, the webtoon with 14.3 billion views worldwide, is now an action RPG game! Help our hero grow from his humble E-Rank beginnings.",8802.0,2068,771
1085660,Destiny 2,"Oct 1, 2019",23,2:Single-player;1:Multi-player;49:PvP;36:Online PvP;9:Co-op;38:Online Co-op;22:Steam Achievements;35:In-App Purchases;66:Color Alternatives;68:Custom Volume Controls;65:Subtitle Options;18:Partial Controller Support,True,False,False,Bungie,15,English*;French*;Italian*;German*;Spanish - Spain*;Japanese*;Korean*;Polish*;Portuguese - Brazil*;Russian*;Simplified Chinese*;Spanish - Latin America*;Traditional Chinese*languages with full audio support,0,0.0,"Destiny 2 is an action MMO with a single evolving world that you and your friends can join anytime, anywhere, absolutely free.",10671.0,100161,32343
1817070,Marvel’s Spider-Man Remastered,"Aug 12, 2022",78,2:Single-player;22:Steam Achievements;64:Adjustable Text Size;67:Camera Comfort;66:Color Alternatives;68:Custom Volume Controls;78:Adjustable Difficulty;74:Playable without Timed Input;79:Save Anytime;69:Stereo Sound;65:Subtitle Options;70:Surround Sound;18:Partial Controller Support;23:Steam Cloud;43:Remote Play on TV;62:Family Sharing,True,False,False,Insomniac Games,0,English*;French*;Italian*;German*;Spanish - Spain*;Czech;Danish;Dutch;Finnish;Greek;Hungarian;Japanese*;Korean;Norwegian;Polish*;Portuguese - Portugal*;Portuguese - Brazil*;Russian*;Spanish - Latin America*;Swedish;Traditional Chinese*languages with full audio support,0,59.99,"In Marvel’s Spider-Man Remastered, the worlds of Peter Parker and Spider-Man collide in an original action-packed story. Play as an experienced Peter Parker, fighting big crime and iconic villains in Marvel’s New York. Web-swing through vibrant neighborhoods and defeat villains with epic takedowns.",6287.0,81442,3295
2623190,The Elder Scrolls IV: Oblivion Remastered,"Apr 22, 2025",60,2:Single-player;22:Steam Achievements;29:Steam Trading Cards;68:Custom Volume Controls;74:Playable without Timed Input;69:Stereo Sound;70:Surround Sound;18:Partial Controller Support;23:Steam Cloud;62:Family Sharing,True,False,False,Bethesda Game Studios,1,English*;French;Italian;German;Spanish - Spain;Japanese;Polish;Portuguese - Brazil;Simplified Chinese*languages with full audio support,17,49.99,Explore Cyrodiil like never before with stunning new visuals and refined gameplay in The Elder Scrolls IV: Oblivion™ Remastered.,2041.0,42551,11661
