appid,name,release_date,achievements,categories,windows,mac,linux,developer,dlc_count,languages,required_age,price,short_description,players_now,reviews_positive,reviews_negative
288470,Fable Anniversary,"Sep 12, 2014",50,2:Single-player;22:Steam Achievements;28:Full controller support;29:Steam Trading Cards;30:Steam Workshop;23:Steam Cloud;41:Remote Play on Phone;42:Remote Play on Tablet;43:Remote Play on TV;62:Family Sharing,True,False,False,Lionhead Studios,3,English*;French*;Italian*;German*;Spanish - Spain*;Japanese*;Korean;Portuguese - Brazil;Russian;Traditional Chinese*languages with full audio support,0,34.99,"FOR EVERY CHOICE, A CONSEQUENCE.Fully re-mastered with HD visuals and audio, Fable Anniversary is a stunning rendition of the original game that will delight faithful fans and new players alike! The all new Heroic difficulty setting will test the mettle of even the most hardcore Fable fan.",245.0,11408,1870
3731020,Five Hearts Under One Roof season2,"Nov 18, 2025",69,2:Single-player;22:Steam Achievements;23:Steam Cloud;62:Family Sharing,True,True,True,Storytaco,2,English;Korean*;Spanish - Latin America;Indonesian;Japanese;Simplified Chinese;Traditional Chinese;Portuguese - Brazil*languages with full audio support,0,22.99,"Boarding house owner Yuman is back! Alongside Mal-sook, Gran, and Min-jung, a wealthy heiress, a girl burdened by childhood scars, and a sweet nurse move in. In this house of old memories and new emotions, who will you fall in love with?",436.0,866,21
346110,ARK: Survival Evolved,"Aug 27, 2017",32,2:Single-player;1:Multi-player;20:MMO;9:Co-op;22:Steam Achievements;28:Full controller support;30:Steam Workshop;23:Steam Cloud;8:Valve Anti-Cheat enabled;17:Includes level editor;42:Remote Play on Tablet;62:Family Sharing,True,True,False,Studio Wildcard,18,English*;French*;Italian*;German*;Spanish - Spain*;Russian*;Portuguese - Brazil*;Simplified Chinese*;Czech*;Danish*;Dutch*;Hungarian*;Polish*;Swedish*;Thai*;Traditional Chinese*;Turkish*;Ukrainian*;Finnish*;Japanese*;Korean**languages with full audio support,0,14.99,"Stranded on the shores of a mysterious island, you must learn to survive. Use your cunning to kill or tame the primeval creatures roaming the land, and encounter other players to survive, dominate... and escape!",20294.0,474297,91249
2916430,Fast Food Simulator,"Dec 10, 2024",11,2:Single-player;1:Multi-player;9:Co-op;38:Online Co-op;22:Steam Achievements;18:Partial Controller Support;23:Steam Cloud;62:Family Sharing,True,False,False,No Ceiling Games,0,English;French;Italian;German;Spanish - Spain;Hungarian;Japanese;Korean;Polish;Portuguese - Brazil;Russian;Simplified Chinese;Spanish - Latin America;Traditional Chinese;Turkish;Ukrainian;Portuguese - Portugal;Arabic;Dutch;Danish;Finnish;Swedish,0,14.99,"Welcome to the world's most chaotic place! Play solo or co-op with up to 6 players. Run a fast-food restaurant, and work with your friends to expand your business. Take orders, make burgers, and increase your earnings by dealing with customers.",387.0,6289,537
3764200,Resident Evil Requiem,"Feb 26, 2026",0,2:Single-player;22:Steam Achievements;28:Full controller support;13:Captions available;61:HDR available;62:Family Sharing,True,False,False,"CAPCOM Co., Ltd.",0,English*;French*;Italian*;German*;Spanish - Spain*;Arabic;Spanish - Latin America*;Portuguese - Brazil*;Polish;Russian*;Simplified Chinese*;Traditional Chinese;Japanese*;Korean*languages with full audio support,17,69.99,Requiem for the dead. Nightmare for the living. Prepare to escape death in a heart-stopping experience that will chill you to your core.,,0,0
1005300,The Jackbox Party Pack 6,"Oct 16, 2019",20,2:Single-player;1:Multi-player;49:PvP;37:Shared/Split Screen PvP;9:Co-op;39:Shared/Split Screen Co-op;24:Shared/Split Screen;22:Steam Achievements;28:Full controller support;29:Steam Trading Cards;23:Steam Cloud;41:Remote Play on Phone;42:Remote Play on Tablet;43:Remote Play on TV;44:Remote Play Together;62:Family Sharing,True,True,True,"Jackbox Games, Inc.",1,English**languages with full audio support,0,29.99,"It’s the wildest Party Pack yet, with the absurd deathmatch Trivia Murder Party 2, the weird word circus Dictionarium, the hidden identity game Push The Button, the comedy contest Joke Boat and the offbeat personality test Role Models.",81.0,2159,109
1922560,Plants vs. Zombies™ Garden Warfare 2: Deluxe Edition,"May 16, 2022",63,2:Single-player;1:Multi-player;49:PvP;36:Online PvP;9:Co-op;38:Online Co-op;22:Steam Achievements;35:In-App Purchases,True,False,False,PopCap,0,English;French;Italian;German;Spanish - Spain;Polish;Portuguese - Brazil;Traditional Chinese,0,29.99,"Ready the Peashooters and prepare for the craziest, funniest shooter in the universe: Plants vs. Zombies Garden Warfare 2.",811.0,31090,3201
1325200,Nioh 2 – The Complete Edition,"Feb 5, 2021",88,2:Single-player;1:Multi-player;9:Co-op;38:Online Co-op;22:Steam Achievements;29:Steam Trading Cards;18:Partial Controller Support;23:Steam Cloud;15:Stats;25:Steam Leaderboards;61:HDR available;62:Family Sharing,True,False,False,"KOEI TECMO GAMES CO., LTD.",0,English*;French;Italian;Spanish - Spain;Spanish - Latin America;Portuguese - Portugal;Portuguese - Brazil;Polish;Russian;Simplified Chinese;Traditional Chinese;Japanese*;Korean;German*languages with full audio support,17,49.99,Battle hordes of yokai in this masocore Action RPG. Create your protagonist and embark on an adventure through a myriad of locales across Japan during the Sengoku period. Utilize the new Yokai Shift ability to defeat even the most ferocious yokai and be prepared to brave through Dark Realms created by your enemies.,2439.0,28286,3875
10090,Call of Duty: World at War,"Nov 18, 2008",0,2:Single-player;1:Multi-player;9:Co-op;62:Family Sharing,True,False,False,Treyarch,0,English;French;Italian;German;Spanish - Spain,17,19.99,"Call of Duty is back, redefining war like you've never experienced before. Building on the Call of Duty 4®: Modern Warfare engine, Call of Duty: World at War immerses players into the most gritty and chaotic WWII combat ever experienced.",335.0,40921,3236
212500,The Lord of the Rings Online™,"Jun 6, 2012",0,1:Multi-player;20:MMO;49:PvP;9:Co-op;35:In-App Purchases;18:Partial Controller Support,True,False,False,Standing Stone Games,0,English*;French*;German**languages with full audio support,0,0.0,Join the world’s greatest fellowship of players in the award-winning online re-creation of J. R. R. Tolkien’s legendary Middle-earth.,939.0,144,27
250760,Shovel Knight: Treasure Trove,"Jun 26, 2014",138,2:Single-player;1:Multi-player;49:PvP;37:Shared/Split Screen PvP;9:Co-op;39:Shared/Split Screen Co-op;24:Shared/Split Screen;22:Steam Achievements;28:Full controller support;29:Steam Trading Cards;23:Steam Cloud;41:Remote Play on Phone;42:Remote Play on Tablet;43:Remote Play on TV;44:Remote Play Together;62:Family Sharing,True,True,True,Yacht Club Games,1,English;French;Italian;German;Spanish - Spain;Portuguese - Brazil;Russian;Japanese;Korean;Simplified Chinese;Traditional Chinese,0,39.99,"Shovel Knight: Treasure Trove is the complete Shovel Knight collection, containing all 5 games in the epic saga! Dig, blast, slash, and bash your way through a fantastical, 8-bit inspired world of pixel-perfect platforming, memorable characters, and world-class action-adventure gameplay.",47.0,13169,618
2058190,Lost Judgment,"Sep 14, 2022",56,2:Single-player;22:Steam Achievements;28:Full controller support;29:Steam Trading Cards;23:Steam Cloud;62:Family Sharing,True,False,False,Ryu Ga Gotoku Studio,1,English*;French;Italian;German;Spanish - Spain;Japanese*;Korean;Simplified Chinese;Traditional Chinese*languages with full audio support,17,59.99,"When a police officer discloses the murder of the student teacher who bullied his son to suicide, the twisted secrets of a Yokohama, high school bleed out. Nothing, in this case, is black and white.",381.0,6132,397
2426960,Summoners War,"Jan 7, 2024",0,1:Multi-player;49:PvP;36:Online PvP;35:In-App Purchases;18:Partial Controller Support,True,False,False,Com2uS,0,English;French;Italian;German;Spanish - Spain;Arabic;Japanese;Korean;Russian;Simplified Chinese;Thai;Traditional Chinese;Turkish;Vietnamese;Indonesian;Portuguese - Brazil,0,0.0,"A global hit RPG that captured the Summoners all around the world! Jump into the Sky Arena, a world under battle over the vital resource: Mana Crystals. Design your own deck and strategy using 1,000 Monsters to claim victory. Go on an epic adventure with your Monsters!",6017.0,0,0
1042550,Digimon Story Cyber Sleuth: Complete Edition,"Oct 17, 2019",103,2:Single-player;1:Multi-player;49:PvP;36:Online PvP;22:Steam Achievements;28:Full controller support;29:Steam Trading Cards;23:Steam Cloud;25:Steam Leaderboards;62:Family Sharing,True,False,False,"h.a.n.d., Inc.",0,English;German;Korean;Traditional Chinese,0,49.99,"With engaging storylines, classic turn-based battles, and tons of Digimon to collect, Digimon Story Cyber Sleuth: Complete Edition delivers everything fans loved about Digimon Story: Cyber Sleuth and Digimon Story: Cyber Sleuth – Hacker’s Memory.",1288.0,8954,959
1900250,Demonschool,"Nov 19, 2025",66,2:Single-player;22:Steam Achievements;28:Full controller support;29:Steam Trading Cards;68:Custom Volume Controls;75:Keyboard Only Option;79:Save Anytime;23:Steam Cloud;15:Stats;62:Family Sharing;63:Steam Timeline,True,True,True,Necrosoft Games,2,English;Japanese;Simplified Chinese;French;Spanish - Latin America,0,24.99,"Demonschool is a new-style tactics RPG where motion equals action. Defeat big weirdos in between the human and demon worlds as Faye and her misfit companions, while navigating university life on a mysterious island.",116.0,448,25
1265920,Life is Strange Remastered,"Feb 1, 2022",60,2:Single-player;22:Steam Achievements;28:Full controller support;62:Family Sharing,True,False,False,Deck Nine,1,English*;French;Italian;German;Spanish - Spain;Portuguese - Brazil;Simplified Chinese;Spanish - Latin America;Russian;Japanese**languages with full audio support,17,39.99,Experience the BAFTA award-winning story of Life is Strange now beautifully remastered with enhanced visuals and vastly improved animation using mocap technology.,188.0,5167,606
2870920,Restaurats,"Nov 7, 2025",51,2:Single-player;1:Multi-player;9:Co-op;38:Online Co-op;22:Steam Achievements;23:Steam Cloud;62:Family Sharing,True,False,False,toR Studio,3,English*;French;German;Portuguese - Brazil;Simplified Chinese;Russian;Turkish;Japanese;Korean;Polish;Traditional Chinese*languages with full audio support,0,19.9,"Lead a medieval restaurant with a team of rats like you! Cook the food, throw it at the guests, wipe the drinks under the skeletons! Become a legendary rat chef, proving to orcs and vampires that the most delicious bloody meat is served in your restaurant!",329.0,869,73
3985030,Air Defender,"Nov 28, 2025",0,2:Single-player;68:Custom Volume Controls;78:Adjustable Difficulty;74:Playable without Timed Input;79:Save Anytime;23:Steam Cloud;62:Family Sharing,True,False,False,ROTOR3,0,English**languages with full audio support,0,26.26,"Command the sky in a tense real-time strategy simulation where you manage a nation's air defenses. Analyze radar contacts, scramble interceptor jets, and make split-second decisions to protect your airspace from hostile threats.",92.0,17,6
1235140,Yakuza: Like a Dragon,"Nov 10, 2020",63,2:Single-player;22:Steam Achievements;28:Full controller support;29:Steam Trading Cards;62:Family Sharing,True,False,False,Ryu Ga Gotoku Studio,6,English*;Japanese*;French;Italian;German;Spanish - Spain;Korean;Portuguese - Brazil;Russian;Simplified Chinese;Traditional Chinese*languages with full audio support,18,19.99,"Become Ichiban Kasuga, a low-ranking yakuza grunt left on the brink of death by the man he trusted most. Take up your legendary bat and get ready to crack some underworld skulls in dynamic RPG combat set against the backdrop of modern-day Japan.",788.0,24618,1510
2361770,SHINOBI: Art of Vengeance,"Aug 28, 2025",29,2:Single-player;22:Steam Achievements;28:Full controller support;29:Steam Trading Cards;66:Color Alternatives;68:Custom Volume Controls;78:Adjustable Difficulty;75:Keyboard Only Option;74:Playable without Timed Input;23:Steam Cloud;62:Family Sharing,True,False,False,SEGA,2,English*;French;Italian;German;Spanish - Spain;Japanese*;Korean;Portuguese - Brazil;Russian;Simplified Chinese;Spanish - Latin America;Traditional Chinese*languages with full audio support,0,29.99,The iconic SHINOBI returns in an all-new 2D action platformer with a unique hand-drawn look created by the team behind the hit brawler Streets of Rage 4.,144.0,1786,372
637650,FINAL FANTASY XV WINDOWS EDITION,"Mar 6, 2018",97,2:Single-player;1:Multi-player;49:PvP;36:Online PvP;9:Co-op;38:Online Co-op;22:Steam Achievements;28:Full controller support;29:Steam Trading Cards;23:Steam Cloud;42:Remote Play on Tablet;62:Family Sharing,True,False,False,Square Enix,3,English*;French*;Italian;German*;Spanish - Spain;Japanese*;Korean;Portuguese - Brazil;Russian*;Simplified Chinese;Traditional Chinese*languages with full audio support,13,34.99,"Take the journey, now in ultimate quality. Boasting a wealth of bonus content and supporting ultra high-resolution graphical options and HDR 10, you can now enjoy the beautiful and carefully-crafted experience of FINAL FANTASY XV like never before.",775.0,35598,7085
200210,Realm of the Mad God Exalt,"Feb 20, 2012",31,1:Multi-player;20:MMO;9:Co-op;38:Online Co-op;35:In-App Purchases;15:Stats,True,True,False,Wild Shadow Studios,6,English**languages with full audio support,0,0.0,"Embark on an exhilarating journey into the pixelated Realm of the Mad God! Join, an action-packed, free-to-play MMO bullet hell game. Discover a world with danger, challenges, and hidden treasures as you battle through waves of enemies. Team up with players and conquer dungeons to become a legend!",880.0,155,39
1237970,Titanfall® 2,"Jun 18, 2020",50,2:Single-player;1:Multi-player;49:PvP;36:Online PvP;22:Steam Achievements;28:Full controller support;29:Steam Trading Cards;41:Remote Play on Phone;42:Remote Play on Tablet;43:Remote Play on TV,True,False,False,Respawn Entertainment,5,English*;French*;Italian*;German*;Spanish - Spain*;Polish*;Portuguese - Portugal*;Russian*;Spanish - Latin America*;Traditional Chinese**languages with full audio support,0,29.99,"Respawn Entertainment gives you the most advanced titan technology in its new, single player campaign &amp; multiplayer experience. Combine &amp; conquer with new titans &amp; pilots, deadlier weapons, &amp; customization and progression systems that help you and your titan flow as one unstoppable killing force.",2402.0,226881,10638
2221490,Tom Clancy’s The Division® 2,"Jan 12, 2023",67,2:Single-player;1:Multi-player;49:PvP;36:Online PvP;9:Co-op;38:Online Co-op;22:Steam Achievements;13:Captions available;35:In-App Purchases;18:Partial Controller Support;61:HDR available,True,False,False,Ubisoft,6,English*;French*;Italian*;German*;Spanish - Spain*;Arabic*;Japanese*;Korean;Polish;Portuguese - Brazil*;Russian*;Simplified Chinese;Spanish - Latin America*;Traditional Chinese*languages with full audio support,17,29.99,"Join an elite group of civilian agents in this action-packed RPG shooter. Engage in intense tactical combat, team-up with your friends, and survive in a dynamic open world to save Washington, D.C.",2530.0,18829,5084
1934570,South of Midnight,"Apr 8, 2025",40,2:Single-player;22:Steam Achievements;28:Full controller support;13:Captions available;23:Steam Cloud;61:HDR available;62:Family Sharing,True,False,False,Compulsion Games,2,English*;French*;Italian;German;Spanish - Spain;Czech;Danish;Dutch;Finnish;Greek;Hungarian;Japanese;Korean;Norwegian;Polish;Portuguese - Brazil;Portuguese - Portugal;Russian;Simplified Chinese;Spanish - Latin America;Swedish;Traditional Chinese;Turkish*languages with full audio support,0,39.99,South of Midnight is a new action-adventure from Compulsion Games. Explore the mythos and confront mysterious creatures of the Deep South in this modern folktale while learning to weave an ancient power to surmount obstacles and unravel your family’s hidden past.,46.0,3270,196
264710,Subnautica,"Jan 23, 2018",17,2:Single-player;22:Steam Achievements;28:Full controller support;53:VR Supported;29:Steam Trading Cards;31:VR Support;23:Steam Cloud;43:Remote Play on TV;62:Family Sharing,True,True,False,Unknown Worlds Entertainment,1,English*;French;German;Polish;Russian;Simplified Chinese;Turkish;Finnish;Italian;Czech;Hungarian;Spanish - Spain;Danish;Japanese;Korean;Portuguese - Brazil;Bulgarian;Ukrainian;Dutch;Swedish;Vietnamese;Spanish - Latin America;Traditional Chinese;Portuguese - Portugal;Latvian;Lithuanian;Slovak*languages with full audio support,0,29.99,"Descend into the depths of an alien underwater world filled with wonder and peril. Craft equipment, pilot submarines and out-smart wildlife to explore lush coral reefs, volcanoes, cave systems, and more - all while trying to survive.",2928.0,289029,8894
1135690,Unpacking,"Nov 1, 2021",25,2:Single-player;22:Steam Achievements;28:Full controller support;29:Steam Trading Cards;64:Adjustable Text Size;67:Camera Comfort;66:Color Alternatives;68:Custom Volume Controls;78:Adjustable Difficulty;76:Mouse Only Option;74:Playable without Timed Input;79:Save Anytime;69:Stereo Sound;23:Steam Cloud;62:Family Sharing,True,True,True,Witch Beam,1,English;French;German;Japanese;Korean;Polish;Portuguese - Brazil;Russian;Simplified Chinese;Spanish - Latin America;Traditional Chinese;Italian;Turkish;Filipino;Indonesian;Malay,0,19.99,"Unpacking is a zen puzzle game about the familiar experience of pulling possessions out of boxes and fitting them into a new home. Part block-fitting puzzle, part home decoration, you are invited to create a satisfying living space while learning clues about the life you’re unpacking.",397.0,29999,2141
1313140,Cult of the Lamb,"Aug 11, 2022",48,2:Single-player;1:Multi-player;9:Co-op;39:Shared/Split Screen Co-op;24:Shared/Split Screen;22:Steam Achievements;28:Full controller support;29:Steam Trading Cards;64:Adjustable Text Size;67:Camera Comfort;68:Custom Volume Controls;78:Adjustable Difficulty;74:Playable without Timed Input;65:Subtitle Options;23:Steam Cloud;44:Remote Play Together;62:Family Sharing,True,True,False,Massive Monster,7,English;French;German;Spanish - Spain;Japanese;Korean;Portuguese - Brazil;Russian;Simplified Chinese;Traditional Chinese,0,24.99,"Start your own cult in a land of false prophets, venturing out into diverse and mysterious regions to build a loyal community of woodland Followers and spread your Word to become the one true cult.",1345.0,91421,4199
2507950,Delta Force,"Dec 4, 2024",53,2:Single-player;1:Multi-player;20:MMO;49:PvP;36:Online PvP;9:Co-op;38:Online Co-op;27:Cross-Platform Multiplayer;22:Steam Achievements;28:Full controller support;29:Steam Trading Cards;35:In-App Purchases,True,False,False,Team Jade,1,English*;Simplified Chinese*;French;German;Russian;Spanish - Latin America;Arabic;Japanese;Korean;Portuguese - Brazil;Traditional Chinese;Turkish*languages with full audio support,0,0.0,"Delta Force is back! The iconic series returns as the definitive free-to-play modern team-based tactical shooter and featuring three distinct gameplay modes: large-scale PvP warfare, intense extraction shooter action, and a remake of the legendary Black Hawk Down campaign.",117925.0,0,0
209000,Batman™: Arkham Origins,"Oct 24, 2013",60,2:Single-player;22:Steam Achievements;28:Full controller support;29:Steam Trading Cards;23:Steam Cloud;25:Steam Leaderboards;62:Family Sharing,True,False,False,WB Games Montreal,6,English*;German*;French*;Italian*;Korean;Spanish - Spain*;Russian;Polish;Portuguese - Brazil**languages with full audio support,13,19.99,"As of December 4, 2016, the online services portion of Batman: Arkham Origins has been retired. We thank those that have joined us to battle. The Single player campaign may still be played and enjoyed offline. For any questions relating to Batman: Arkham Origins, please contact WB Games customer service.",596.0,37436,4267
1179680,Wurm Online,"Jul 24, 2020",80,1:Multi-player;20:MMO;49:PvP;36:Online PvP;9:Co-op;38:Online Co-op;27:Cross-Platform Multiplayer;35:In-App Purchases,True,True,True,Code Club AB,0,English**languages with full audio support,0,0.0,"A sandbox MMORPG that has pushed the boundaries on what it means to be open world and stood the test of time. Dig, mine, shape the world around you and make your lasting mark!",101.0,0,0
115320,Prototype 2,"Jul 24, 2012",43,2:Single-player;22:Steam Achievements;23:Steam Cloud;15:Stats;25:Steam Leaderboards;62:Family Sharing,True,False,False,Radical Entertainment,1,English*;French;German;Italian;Spanish - Spain*languages with full audio support,17,39.99,Become the ultimate shape-shifting weapon!,172.0,7393,2475
976310,Mortal Kombat 11,"Apr 23, 2019",58,2:Single-player;1:Multi-player;49:PvP;36:Online PvP;37:Shared/Split Screen PvP;22:Steam Achievements;28:Full controller support;29:Steam Trading Cards;35:In-App Purchases;68:Custom Volume Controls;75:Keyboard Only Option;71:Narrated Game Menus;69:Stereo Sound;70:Surround Sound;23:Steam Cloud;41:Remote Play on Phone;42:Remote Play on Tablet;43:Remote Play on TV;44:Remote Play Together;61:HDR available;62:Family Sharing,True,False,False,NetherRealm Studios,27,English*;French*;Italian*;German*;Spanish - Spain;Arabic;Polish;Portuguese - Brazil*;Russian;Simplified Chinese;Spanish - Latin America*;Traditional Chinese*languages with full audio support,18,49.99,Mortal Kombat is back and better than ever in the next evolution of the iconic franchise.,2470.0,73051,9518
2005010,"Warhammer 40,000: Boltgun","May 23, 2023",21,2:Single-player;22:Steam Achievements;28:Full controller support;29:Steam Trading Cards;67:Camera Comfort;68:Custom Volume Controls;78:Adjustable Difficulty;74:Playable without Timed Input;79:Save Anytime;69:Stereo Sound;65:Subtitle Options;70:Surround Sound;62:Family Sharing,True,False,False,Auroch Digital,1,English*;French;Italian;German;Spanish - Spain;Czech;Japanese;Korean;Polish;Portuguese - Brazil;Russian;Simplified Chinese;Spanish - Latin America;Traditional Chinese*languages with full audio support,0,21.99,"Load up your Boltgun and unleash the awesome Space Marine arsenal to blast your way through an explosion of sprites, pixels and blood in a perfect blend of Warhammer 40,000, frenetic gameplay and the stylish visuals of 90’s retro shooters.",142.0,12940,1335
2523720,Gears of War: Reloaded,"Aug 26, 2025",56,2:Single-player;1:Multi-player;49:PvP;36:Online PvP;9:Co-op;38:Online Co-op;27:Cross-Platform Multiplayer;22:Steam Achievements;28:Full controller support;13:Captions available;72:Chat Speech-to-text;73:Chat Text-to-speech;66:Color Alternatives;68:Custom Volume Controls;78:Adjustable Difficulty;71:Narrated Game Menus;69:Stereo Sound;70:Surround Sound;23:Steam Cloud;62:Family Sharing,True,False,False,The Coalition,0,English*;French*;Italian*;German*;Spanish - Spain*;Korean;Polish;Portuguese - Brazil*;Russian*;Spanish - Latin America*;Traditional Chinese;Japanese*languages with full audio support,17,39.99,"Experience the origins of one of gaming’s most acclaimed franchises like never before, faithfully remastered and optimized for PC.",84.0,1407,1058
1392860,Little Nightmares III,"Oct 9, 2025",32,2:Single-player;1:Multi-player;9:Co-op;38:Online Co-op;22:Steam Achievements;28:Full controller support;64:Adjustable Text Size;67:Camera Comfort;66:Color Alternatives;68:Custom Volume Controls;75:Keyboard Only Option;74:Playable without Timed Input;69:Stereo Sound;70:Surround Sound;23:Steam Cloud;62:Family Sharing,True,False,False,Supermassive Games,6,English;French;Italian;German;Spanish - Spain;Arabic;Japanese;Korean;Polish;Portuguese - Brazil;Russian;Simplified Chinese;Traditional Chinese;Spanish - Latin America;Indonesian;Thai,0,39.99,"Little Nightmares III is an atmospheric adventure game in which you follow the journey of Low and Alone, two best friends in search of a way out of the Nowhere. In 2 players online cooperation or solo with an A.I., work together to solve puzzles and survive in this nightmarish world.",527.0,3657,4293
1552350,The Jackbox Party Pack 8,"Oct 13, 2021",20,1:Multi-player;49:PvP;37:Shared/Split Screen PvP;9:Co-op;39:Shared/Split Screen Co-op;24:Shared/Split Screen;22:Steam Achievements;18:Partial Controller Support;44:Remote Play Together;62:Family Sharing,True,True,True,"Jackbox Games, Inc.",1,English**languages with full audio support,0,29.99,"Plan your next game night! Jackbox Games is back with 5 hilarious new party games including Drawful Animate, Job Job, The Poll Mine, Weapons Drawn, and The Wheel of Enormous Proportions.",50.0,989,104
2893570,DRAGON QUEST I & II HD-2D Remake,"Oct 30, 2025",48,2:Single-player;22:Steam Achievements;29:Steam Trading Cards;67:Camera Comfort;68:Custom Volume Controls;78:Adjustable Difficulty;75:Keyboard Only Option;74:Playable without Timed Input;18:Partial Controller Support;23:Steam Cloud;62:Family Sharing,True,False,False,Square Enix,0,English*;French;Italian;German;Spanish - Spain;Japanese*;Korean;Simplified Chinese;Spanish - Latin America;Traditional Chinese*languages with full audio support,0,59.99,"DRAGON QUEST I &amp; II HD-2D Remake is a stunning reimagination of the first two legendary adventures in The Erdrick Trilogy, brought together in one package.",2965.0,829,180
