appid,name,release_date,achievements,categories,windows,mac,linux,developer,dlc_count,languages,required_age,price,short_description,players_now,reviews_positive,reviews_negative
2677660,Indiana Jones and the Great Circle,"Dec 8, 2024",55,2:Single-player;22:Steam Achievements;28:Full controller support;29:Steam Trading Cards;13:Captions available;66:Color Alternatives;68:Custom Volume Controls;78:Adjustable Difficulty;74:Playable without Timed Input;70:Surround Sound;23:Steam Cloud;61:HDR available;62:Family Sharing,True,False,False,MachineGames,1,English*;French*;Italian*;German*;Spanish - Spain*;Arabic;Japanese*;Korean;Polish*;Portuguese - Brazil*;Russian;Simplified Chinese;Spanish - Latin America*;Traditional Chinese*languages with full audio support,0,69.99,"Uncover one of history’s greatest mysteries in a first-person, single-player adventure. The year is 1937, sinister forces are scouring the globe for the secret to an ancient power connected to the Great Circle, and only one person can stop them - Indiana Jones™.",516.0,9620,1121
1363080,Manor Lords,"Apr 26, 2024",11,2:Single-player;22:Steam Achievements;64:Adjustable Text Size;67:Camera Comfort;68:Custom Volume Controls;78:Adjustable Difficulty;76:Mouse Only Option;79:Save Anytime;69:Stereo Sound;23:Steam Cloud;62:Family Sharing,True,False,False,Slavic Magic,0,English*;German;Polish;Simplified Chinese;French;Japanese;Spanish - Spain;Korean;Portuguese - Brazil;Russian;Traditional Chinese;Italian;Turkish;Czech;Danish;Dutch;Hungarian;Swedish;Ukrainian*languages with full audio support,0,39.99,"Manor Lords is a medieval strategy game featuring in-depth city building, large-scale tactical battles, and complex economic and social simulations. Rule your lands as a medieval lord – the seasons pass, the weather changes, and cities rise and fall.",3098.0,56818,9671
739630,Phasmophobia,"Sep 18, 2020",54,2:Single-player;1:Multi-player;9:Co-op;38:Online Co-op;22:Steam Achievements;28:Full controller support;52:Tracked Controller Support;53:VR Supported;29:Steam Trading Cards;67:Camera Comfort;78:Adjustable Difficulty;74:Playable without Timed Input;69:Stereo Sound;70:Surround Sound;23:Steam Cloud;41:Remote Play on Phone;42:Remote Play on Tablet;62:Family Sharing,True,False,False,Kinetic Games,0,English*;Portuguese - Portugal;Spanish - Spain;Portuguese - Brazil;German;French;Italian;Bulgarian;Czech;Danish;Dutch;Finnish;Greek;Hungarian;Japanese;Korean;Norwegian;Polish;Romanian;Russian;Simplified Chinese;Swedish;Traditional Chinese;Turkish;Ukrainian;Catalan*languages with full audio support,0,19.99,Phasmophobia is a 4 player online co-op psychological horror. Paranormal activity is on the rise and it’s up to you and your team to use all the ghost-hunting equipment at your disposal in order to gather as much evidence as you can.,7092.0,623492,26713
2958130,Jurassic World Evolution 3,"Oct 21, 2025",33,2:Single-player;22:Steam Achievements;28:Full controller support;29:Steam Trading Cards;67:Camera Comfort;66:Color Alternatives;68:Custom Volume Controls;74:Playable without Timed Input;79:Save Anytime;69:Stereo Sound;65:Subtitle Options;70:Surround Sound;23:Steam Cloud;61:HDR available;62:Family Sharing,True,False,False,Frontier Developments,2,English*;French*;German*;Spanish - Spain*;Portuguese - Brazil*;Simplified Chinese*;Spanish - Latin America*;Italian;Japanese*;Korean;Polish;Traditional Chinese*languages with full audio support,0,59.99,"Build your own Jurassic World. Nurture generations of dinosaurs with the series debut of juveniles, create and manage sprawling prehistoric parks around the globe, and let your imagination roar with powerful new creative options.",2170.0,4596,350
1716740,Starfield,"Sep 5, 2023",62,2:Single-player;22:Steam Achievements;28:Full controller support;29:Steam Trading Cards;66:Color Alternatives;74:Playable without Timed Input;69:Stereo Sound;70:Surround Sound;23:Steam Cloud;62:Family Sharing,True,False,False,Bethesda Game Studios,4,English*;French*;Italian;German*;Spanish - Spain*;Japanese*;Polish;Portuguese - Brazil;Simplified Chinese*languages with full audio support,17,69.99,"Starfield is the first new universe in 25 years from Bethesda Game Studios, the award-winning creators of The Elder Scrolls V: Skyrim and Fallout 4.",2257.0,64738,45818
2399830,ARK: Survival Ascended,"Oct 25, 2023",32,2:Single-player;1:Multi-player;20:MMO;49:PvP;36:Online PvP;47:LAN PvP;9:Co-op;38:Online Co-op;48:LAN Co-op;39:Shared/Split Screen Co-op;24:Shared/Split Screen;27:Cross-Platform Multiplayer;22:Steam Achievements;28:Full controller support;17:Includes level editor;44:Remote Play Together;62:Family Sharing,True,False,False,Studio Wildcard,15,English*;French;Italian;German;Spanish - Spain;Danish;Dutch;Japanese;Korean;Portuguese - Brazil;Portuguese - Portugal;Russian;Simplified Chinese;Spanish - Latin America;Traditional Chinese;Turkish*languages with full audio support,0,44.99,"ARK is reimagined from the ground-up into the next-generation of video game technology with Unreal Engine 5! Form a tribe, tame &amp; breed hundreds of unique dinosaurs and primeval creatures, explore, craft, build, and fight your way to the top of the food-chain. Your new world awaits!",18290.0,48205,32292
1282100,REMNANT II®,"Jul 25, 2023",65,2:Single-player;1:Multi-player;9:Co-op;38:Online Co-op;22:Steam Achievements;28:Full controller support;23:Steam Cloud;62:Family Sharing,True,False,False,Gunfire Games,3,English*;French*;Italian*;German*;Spanish - Spain*;Japanese;Korean;Portuguese - Brazil;Russian*;Simplified Chinese**languages with full audio support,17,49.99,REMNANT II® pits survivors of humanity against new deadly creatures and god-like bosses across terrifying worlds. Play solo or co-op with two other friends to explore the depths of the unknown to stop an evil from destroying reality itself.,2878.0,35652,7064
1145350,Hades II,"Sep 25, 2025",50,2:Single-player;22:Steam Achievements;28:Full controller support;29:Steam Trading Cards;13:Captions available;23:Steam Cloud;62:Family Sharing,True,True,False,Supergiant Games,1,English*;French;Italian;German;Spanish - Spain;Greek;Japanese;Korean;Polish;Portuguese - Brazil;Russian;Simplified Chinese;Traditional Chinese;Turkish;Ukrainian*languages with full audio support,0,29.99,Battle beyond the Underworld using dark sorcery to take on the Titan of Time in this bewitching sequel to the award-winning rogue-like dungeon crawler.,13192.0,90757,4286
1868140,DAVE THE DIVER,"Jun 28, 2023",43,2:Single-player;22:Steam Achievements;28:Full controller support;29:Steam Trading Cards;23:Steam Cloud;62:Family Sharing,True,True,False,MINTROCKET,4,English;Korean;Japanese;Simplified Chinese;German;Spanish - Spain;Traditional Chinese;French;Portuguese - Brazil;Italian;Russian,0,19.99,"DAVE THE DIVER is a casual, singleplayer adventure RPG featuring deep-sea exploration and fishing during the day and sushi restaurant management at night. Join Dave and his quirky friends as they seek to uncover the secrets of the mysterious Blue Hole.",10346.0,121342,3753
1971870,Mortal Kombat 1,"Sep 19, 2023",50,2:Single-player;1:Multi-player;49:PvP;36:Online PvP;37:Shared/Split Screen PvP;24:Shared/Split Screen;27:Cross-Platform Multiplayer;22:Steam Achievements;28:Full controller support;29:Steam Trading Cards;35:In-App Purchases;72:Chat Speech-to-text;73:Chat Text-to-speech;68:Custom Volume Controls;75:Keyboard Only Option;71:Narrated Game Menus;69:Stereo Sound;65:Subtitle Options;70:Surround Sound;23:Steam Cloud;43:Remote Play on TV;44:Remote Play Together;61:HDR available;62:Family Sharing,True,False,False,NetherRealm Studios,28,English*;French*;Italian*;German*;Spanish - Spain*;Arabic;Polish;Portuguese - Brazil*;Russian;Simplified Chinese;Spanish - Latin America*;Traditional Chinese;Korean*languages with full audio support,18,49.99,"Discover a reborn Mortal Kombat™ Universe created by the Fire God Liu Kang. Mortal Kombat™ 1 ushers in a new era of the iconic franchise with a new fighting system, game modes, and fatalities!",1773.0,20033,7535
1449110,The Outer Worlds 2,"Oct 29, 2025",48,2:Single-player;22:Steam Achievements;28:Full controller support;29:Steam Trading Cards;68:Custom Volume Controls;78:Adjustable Difficulty;79:Save Anytime;69:Stereo Sound;65:Subtitle Options;70:Surround Sound;23:Steam Cloud;15:Stats;62:Family Sharing,True,False,False,Obsidian Entertainment,0,English*;French;Italian;German;Spanish - Spain;Japanese;Korean;Polish;Portuguese - Brazil;Russian;Simplified Chinese;Spanish - Latin America*languages with full audio support,0,69.99,The Outer Worlds 2 is the sequel to the award-winning first-person sci-fi RPG from Obsidian Entertainment.,1652.0,4037,1237
784080,MechWarrior 5: Mercenaries,"May 26, 2021",19,2:Single-player;1:Multi-player;9:Co-op;38:Online Co-op;22:Steam Achievements;30:Steam Workshop;18:Partial Controller Support;62:Family Sharing,True,False,False,Piranha Games Inc.,8,English*;French;German;Russian;Japanese*languages with full audio support,0,29.99,The year is 3015. The battlefields are dominated by war machines known as BattleMechs. Level entire cities and decimate the enemy in your BattleMech. Follow a quest for glory and revenge. Manage an expanding mercenary company. Fight alongside your friends with a four-player PvE co-op.,1170.0,9868,1785
440,Team Fortress 2,"Oct 10, 2007",520,1:Multi-player;27:Cross-Platform Multiplayer;22:Steam Achievements;29:Steam Trading Cards;13:Captions available;30:Steam Workshop;35:In-App Purchases;67:Camera Comfort;66:Color Alternatives;68:Custom Volume Controls;69:Stereo Sound;70:Surround Sound;18:Partial Controller Support;8:Valve Anti-Cheat enabled;15:Stats;17:Includes level editor;14:Commentary available;41:Remote Play on Phone;42:Remote Play on Tablet,True,False,True,Valve,1,English*;Danish;Dutch;Finnish;French;German;Italian;Japanese;Norwegian;Polish;Portuguese - Portugal;Russian;Simplified Chinese;Spanish - Spain;Swedish;Traditional Chinese;Korean;Czech;Hungarian;Portuguese - Brazil;Turkish;Greek;Bulgarian;Romanian;Thai;Ukrainian;Spanish - Latin America*languages with full audio support,0,0.0,"Nine distinct classes provide a broad range of tactical abilities and personalities. Constantly updated with new game modes, maps, equipment and, most importantly, hats!",54122.0,36207,9075
1771300,Kingdom Come: Deliverance II,"Feb 4, 2025",83,2:Single-player;22:Steam Achievements;28:Full controller support;29:Steam Trading Cards;68:Custom Volume Controls;74:Playable without Timed Input;69:Stereo Sound;70:Surround Sound;23:Steam Cloud;62:Family Sharing,True,False,False,Warhorse Studios,8,English*;Italian;French*;German*;Spanish - Spain*;Czech*;Japanese*;Korean;Polish;Portuguese - Brazil;Simplified Chinese;Traditional Chinese;Turkish;Russian;Ukrainian*languages with full audio support,18,59.99,"A thrilling story-driven action RPG, with a rich open world, set in 15th century Medieval Europe. Experience the ultimate medieval adventure - through the eyes of young Henry - as you embark on a journey of epic proportions.",20553.0,98672,6043
2073850,THE FINALS,"Dec 7, 2023",50,1:Multi-player;49:PvP;36:Online PvP;9:Co-op;38:Online Co-op;27:Cross-Platform Multiplayer;22:Steam Achievements;28:Full controller support;35:In-App Purchases,True,False,False,Embark Studios,34,English*;French;German;Spanish - Spain;Japanese;Korean;Portuguese - Brazil;Simplified Chinese;Traditional Chinese;Polish;Turkish*languages with full audio support,0,0.0,"THE FINALS is the world’s first Dynamism Shooter, a free-to-play, fast-paced, physics-driven, first-person shooter set on the stage of the biggest Gameshow of the future! Fight for Fans and fortune in fully-destructible, virtual Arenas that guarantee no two rounds will ever play the same!",7469.0,12,2
284160,BeamNG.drive,"May 29, 2015",5,2:Single-player;22:Steam Achievements;29:Steam Trading Cards;67:Camera Comfort;68:Custom Volume Controls;75:Keyboard Only Option;69:Stereo Sound;70:Surround Sound;18:Partial Controller Support;23:Steam Cloud;17:Includes level editor;41:Remote Play on Phone;42:Remote Play on Tablet;44:Remote Play Together;62:Family Sharing,True,False,False,BeamNG,0,English;French;Japanese;Korean;Portuguese - Portugal;Portuguese - Brazil;Russian;Simplified Chinese;Spanish - Latin America;Traditional Chinese;Spanish - Spain;German;Polish,0,24.99,A dynamic soft-body physics vehicle simulator capable of doing just about anything.,18147.0,320304,8365
2352620,Fellowship,"Oct 16, 2025",0,1:Multi-player;9:Co-op;38:Online Co-op;64:Adjustable Text Size;67:Camera Comfort;68:Custom Volume Controls;78:Adjustable Difficulty;74:Playable without Timed Input;69:Stereo Sound;62:Family Sharing,True,False,False,Chief Rebel,3,English*;French;Italian;German;Spanish - Spain;Russian;Simplified Chinese;Traditional Chinese;Korean;Portuguese - Brazil;Japanese*languages with full audio support,0,24.99,"FELLOWSHIP is a multiplayer online dungeon adventure set in an exciting fantasy setting, with endlessly scaling dungeon runs.",3634.0,9619,3028
1158310,Crusader Kings III,"Sep 1, 2020",188,2:Single-player;1:Multi-player;49:PvP;36:Online PvP;22:Steam Achievements;29:Steam Trading Cards;30:Steam Workshop;23:Steam Cloud;42:Remote Play on Tablet;62:Family Sharing,True,True,True,Paradox Development Studio,23,English*;French;German;Spanish - Spain;Russian;Simplified Chinese;Korean;Polish;Japanese*languages with full audio support,0,49.99,"Love, fight, scheme, and claim greatness. Determine your noble house’s legacy in the sprawling grand strategy of Crusader Kings III. Death is only the beginning as you guide your dynasty’s bloodline in the rich and larger-than-life simulation of the Middle Ages.",20813.0,78781,8016
42700,Call of Duty®: Black Ops,"Nov 9, 2010",68,2:Single-player;1:Multi-player;9:Co-op;22:Steam Achievements;18:Partial Controller Support;8:Valve Anti-Cheat enabled;62:Family Sharing,True,False,False,Treyarch,4,English;German;Italian;Spanish - Spain;French,17,39.99,The biggest first-person action series of all time and the follow-up to critically acclaimed Call of Duty®: Modern Warfare 2 returns with Call of Duty®: Black Ops.,482.0,19096,1829
1895880,Ratchet & Clank: Rift Apart,"Jul 26, 2023",47,2:Single-player;22:Steam Achievements;18:Partial Controller Support;23:Steam Cloud;62:Family Sharing,True,False,False,Insomniac Games,0,English*;French*;Italian*;German*;Spanish - Spain*;Czech;Danish*;Dutch*;Finnish*;Greek;Hungarian;Japanese*;Korean;Norwegian*;Polish*;Portuguese - Brazil*;Portuguese - Portugal*;Romanian;Russian*;Simplified Chinese;Spanish - Latin America*;Swedish*;Traditional Chinese;Turkish;Croatian*languages with full audio support,0,59.99,Blast your way through an interdimensional adventure with Ratchet and Clank – now on PC! Help them take on an evil emperor from another reality as you jump between action-packed worlds and beyond at hyper-speed!,726.0,8594,966
1669000,Age of Wonders 4,"May 2, 2023",100,2:Single-player;1:Multi-player;49:PvP;36:Online PvP;9:Co-op;38:Online Co-op;27:Cross-Platform Multiplayer;22:Steam Achievements;30:Steam Workshop;67:Camera Comfort;72:Chat Speech-to-text;73:Chat Text-to-speech;68:Custom Volume Controls;78:Adjustable Difficulty;74:Playable without Timed Input;79:Save Anytime;69:Stereo Sound;70:Surround Sound;18:Partial Controller Support;23:Steam Cloud;44:Remote Play Together;62:Family Sharing,True,False,False,Triumph Studios,15,English*;French;German;Spanish - Spain;Japanese;Korean;Polish;Russian;Simplified Chinese*languages with full audio support,13,49.99,Rule a fantasy realm of your own design! Explore new magical realms in Age of Wonders’ signature blend of 4X strategy and turn-based tactical combat. Control a faction that grows and changes as you expand your empire with each turn!,3629.0,12410,2702
1030300,Hollow Knight: Silksong,"Sep 4, 2025",52,2:Single-player;22:Steam Achievements;28:Full controller support;29:Steam Trading Cards;67:Camera Comfort;75:Keyboard Only Option;74:Playable without Timed Input;79:Save Anytime;69:Stereo Sound;23:Steam Cloud;43:Remote Play on TV;62:Family Sharing,True,True,True,Team Cherry,1,English*;French*;Italian*;German*;Spanish - Spain*;Japanese*;Korean*;Portuguese - Brazil*;Russian*;Simplified Chinese**languages with full audio support,0,19.99,"Discover a vast, haunted kingdom in Hollow Knight: Silksong! Explore, fight and survive as you ascend to the peak of a land ruled by silk and song.",18098.0,285263,39600
413420,Danganronpa 2: Goodbye Despair,"Apr 18, 2016",47,2:Single-player;22:Steam Achievements;28:Full controller support;29:Steam Trading Cards;23:Steam Cloud;41:Remote Play on Phone;42:Remote Play on Tablet;62:Family Sharing,True,True,True,"Spike Chunsoft Co., Ltd.",0,English*;Japanese*;Traditional Chinese*languages with full audio support,0,19.99,"Jabberwock Island—You and your classmates were ready for fun in the sun until Monokuma returned to restart his murderous game! Trapped in a kill-or-be-killed situation, your only hope rests in solving the island’s mysteries.",869.0,25049,982
2062430,BALL x PIT,"Oct 15, 2025",63,2:Single-player;22:Steam Achievements;28:Full controller support;23:Steam Cloud;25:Steam Leaderboards;62:Family Sharing,True,True,False,Kenny Sun and Friends,1,English;French;German;Spanish - Spain;Japanese;Korean;Portuguese - Brazil;Russian;Simplified Chinese;Traditional Chinese,0,14.99,"BALL x PIT is a brick-breaking, ball-fusing, base-building survival roguelite. Batter hordes of enemies with ricocheting balls and gather the riches of the pit to expand your homestead, generate resources and recruit unique heroes.",5145.0,13604,598
413150,Stardew Valley,"Feb 26, 2016",49,2:Single-player;1:Multi-player;9:Co-op;38:Online Co-op;48:LAN Co-op;39:Shared/Split Screen Co-op;24:Shared/Split Screen;22:Steam Achievements;28:Full controller support;29:Steam Trading Cards;23:Steam Cloud;41:Remote Play on Phone;42:Remote Play on Tablet;44:Remote Play Together;62:Family Sharing,True,True,True,ConcernedApe,1,English;German;Spanish - Spain;Japanese;Portuguese - Brazil;Russian;Simplified Chinese;French;Italian;Hungarian;Korean;Turkish,0,14.99,"You've inherited your grandfather's old farm plot in Stardew Valley. Armed with hand-me-down tools and a few coins, you set out to begin your new life. Can you learn to live off the land and turn these overgrown fields into a thriving home?",56336.0,801769,12230
1962663,Call of Duty®: Warzone™,"Nov 16, 2022",0,2:Single-player;1:Multi-player;49:PvP;36:Online PvP;9:Co-op;38:Online Co-op;27:Cross-Platform Multiplayer;22:Steam Achievements;28:Full controller support;13:Captions available;35:In-App Purchases,True,False,False,Infinity Ward,0,English*;French*;Italian*;German*;Spanish - Spain*;Arabic;Japanese*;Korean*;Polish*;Portuguese - Brazil*;Russian*;Simplified Chinese;Spanish - Latin America*;Traditional Chinese*languages with full audio support,0,0.0,"Welcome to Call of Duty®: Warzone™, the massive free-to-play combat arena. Experience thrilling modes &amp; new gameplay features in Verdansk and Rebirth Island.",8.0,2407,7039
1659420,UNCHARTED™: Legacy of Thieves Collection,"Oct 19, 2022",101,2:Single-player;22:Steam Achievements;28:Full controller support;68:Custom Volume Controls;78:Adjustable Difficulty;79:Save Anytime;69:Stereo Sound;70:Surround Sound;23:Steam Cloud;43:Remote Play on TV;62:Family Sharing,True,False,False,Naughty Dog LLC,0,English*;French*;Italian*;German*;Spanish - Spain*;Czech;Danish;Dutch*;Finnish;Greek;Japanese*;Korean;Norwegian;Polish*;Portuguese - Portugal*;Portuguese - Brazil*;Russian*;Simplified Chinese;Spanish - Latin America*;Swedish;Traditional Chinese;Turkish**languages with full audio support,0,49.99,Play as Nathan Drake and Chloe Frazer in their own standalone adventures as they confront their pasts and forge their own legacies. This game includes the critically acclaimed single-player stories from both UNCHARTED 4: A Thief’s End and UNCHARTED: The Lost Legacy.,2272.0,19871,2154
813780,Age of Empires II: Definitive Edition,"Nov 14, 2019",344,2:Single-player;1:Multi-player;49:PvP;36:Online PvP;47:LAN PvP;9:Co-op;38:Online Co-op;48:LAN Co-op;27:Cross-Platform Multiplayer;22:Steam Achievements;29:Steam Trading Cards;23:Steam Cloud;17:Includes level editor;62:Family Sharing,True,False,False,World's Edge,14,English*;French*;Italian*;German*;Japanese;Korean*;Portuguese - Brazil*;Russian;Simplified Chinese*;Spanish - Latin America*;Traditional Chinese*;Turkish;Vietnamese;Spanish - Spain*;Polish;Hindi;Malay*languages with full audio support,0,34.99,"42 Civilizations, 229 Campaign Missions, Singleplayer, Co-Op, Multiplayer, In-Game Editor, Mods, Cross-play...It is good to be the king.",15488.0,141027,7498
208650,Batman™: Arkham Knight,"Jun 23, 2015",113,2:Single-player;22:Steam Achievements;28:Full controller support;29:Steam Trading Cards;23:Steam Cloud;25:Steam Leaderboards;41:Remote Play on Phone;42:Remote Play on Tablet;43:Remote Play on TV;62:Family Sharing,True,False,False,Rocksteady Studios,24,English*;French*;Italian*;German*;Spanish - Spain*;Korean;Portuguese - Brazil*;Polish;Russian;Japanese**languages with full audio support,17,19.99,"Batman™: Arkham Knight brings the award-winning Arkham trilogy from Rocksteady Studios to its epic conclusion. Developed exclusively for New-Gen platforms, Batman: Arkham Knight introduces Rocksteady's uniquely designed version of the Batmobile.",1781.0,94061,7865
1290000,PowerWash Simulator,"Jul 14, 2022",100,2:Single-player;1:Multi-player;9:Co-op;38:Online Co-op;27:Cross-Platform Multiplayer;22:Steam Achievements;28:Full controller support;29:Steam Trading Cards;23:Steam Cloud;62:Family Sharing,True,False,False,FuturLab,17,English;Korean;Russian;French;German;Spanish - Spain;Japanese;Simplified Chinese;Traditional Chinese;Italian;Turkish;Portuguese - Brazil,0,24.99,"Release the Pressure with PowerWash Simulator! Wash away your worries with the soothing sounds of high-pressure water. Fire up your power washer and blast away every speck of dirt and grime you can find, all with the simple satisfaction of power-washing to a sparkling finish.",1858.0,47031,1489
552990,World of Warships,"Nov 15, 2017",43,1:Multi-player;20:MMO;49:PvP;36:Online PvP;9:Co-op;38:Online Co-op;22:Steam Achievements;29:Steam Trading Cards;35:In-App Purchases;64:Adjustable Text Size;67:Camera Comfort;66:Color Alternatives;68:Custom Volume Controls;74:Playable without Timed Input;23:Steam Cloud,True,False,False,Wargaming Group Limited,25,English*;French*;German*;Czech;Japanese*;Polish*;Russian*;Thai;Turkish;Spanish - Spain*;Korean*;Portuguese - Brazil*;Traditional Chinese*;Italian*;Simplified Chinese*;Ukrainian;Dutch*;Spanish - Latin America**languages with full audio support,0,0.0,"Immerse yourself in thrilling naval battles and assemble an armada of over 600 ships from the first half of the 20th century — from stealthy destroyers to gigantic battleships. Change the look of your ship, choose upgrades to suit your play style, and go into battle with other players!",50616.0,1479,523
594570,Total War: WARHAMMER II,"Sep 28, 2017",152,2:Single-player;1:Multi-player;49:PvP;36:Online PvP;47:LAN PvP;9:Co-op;38:Online Co-op;48:LAN Co-op;22:Steam Achievements;29:Steam Trading Cards;30:Steam Workshop;67:Camera Comfort;66:Color Alternatives;68:Custom Volume Controls;78:Adjustable Difficulty;74:Playable without Timed Input;79:Save Anytime;69:Stereo Sound;70:Surround Sound;42:Remote Play on Tablet;62:Family Sharing,True,True,True,CREATIVE ASSEMBLY,22,English*;French;Italian;German;Spanish - Spain;Czech;Korean;Polish;Portuguese - Brazil;Russian;Turkish;Simplified Chinese;Traditional Chinese*languages with full audio support,0,59.99,"Strategy gaming perfected. A breath-taking campaign of exploration, expansion and conquest across a fantasy world. Turn-based civilisation management and real-time epic strategy battles with thousands of troops and monsters at your command.",1553.0,78713,5984
1172710,Dune: Awakening,"Jun 10, 2025",73,2:Single-player;1:Multi-player;9:Co-op;38:Online Co-op;22:Steam Achievements;28:Full controller support;64:Adjustable Text Size;67:Camera Comfort;66:Color Alternatives;68:Custom Volume Controls;74:Playable without Timed Input;79:Save Anytime;69:Stereo Sound;65:Subtitle Options;70:Surround Sound;23:Steam Cloud,True,False,False,Funcom,2,English*;French;Italian;German;Spanish - Spain;Japanese;Korean;Polish;Portuguese - Brazil;Russian;Simplified Chinese;Traditional Chinese;Turkish;Ukrainian*languages with full audio support,17,49.99,"Dune: Awakening is an Open World Survival RPG where you can fully immerse yourself in the epic world of Dune. Alone or with friends, explore a vast open world Arrakis, survive the sandworms, build a home, craft an ornithopter, and unravel the mystery of the missing Fremen.",4052.0,42922,16903
2537590,Microsoft Flight Simulator 2024,"Nov 19, 2024",27,2:Single-player;1:Multi-player;27:Cross-Platform Multiplayer;22:Steam Achievements;35:In-App Purchases;18:Partial Controller Support;61:HDR available;62:Family Sharing,True,False,False,Asobo Studio,1,English*;French*;Italian*;German*;Spanish - Spain*;Dutch*;Finnish*;Japanese*;Korean*;Norwegian*;Polish*;Portuguese - Brazil*;Portuguese - Portugal*;Russian*;Simplified Chinese*;Spanish - Latin America*;Swedish*;Turkish**languages with full audio support,0,69.99,Explore the world with our largest fleet of aircraft and take simulation to new heights while pursuing your aviation career within Microsoft Flight Simulator 2024.,3245.0,8011,7893
